id,article_title,article_language,journal_title,jounral_abbreviation,journal_issn,article_jvolumn,article_jissue,article_jcreated_at,article_pagination,author_list
681305,"Pooled analysis of non-union, re-operation, infection, and approach related complications after anterior odontoid screw fixation.",eng,eng,,1932-6203,,21.0,1.0,e103065,
541739,"Aicuracy, risk and the intrinsic value of diagnostic imaging: a review of the cost-utility literature.",,Academic radiology,,1878-4046,,,,599-606,
558824,Swabbing Surgical Sites Does Not Improve the Detection of Staphylococcus aureus Carriage in High-Risk Surgical Patients,PLoS One,,,,,0.0,42.0,,"{""M. S. Ihara"",""J. R. Tripet-Diel"",""K. Shahlaie"",""C. S. Li"",""J. Brown"",""S. H. Cohen"",""M. Giordani"",""E. O. Klineberg""}"
954980,,,Cwinese Journal of Evidence-Based Medicine,0022-9776,,1/13/01,5.0,1/15/01,542-549,"{rQ. X. Zhang"",""J. H. Tian"",""X. Y. Tan"",""A. L. Yang"",""X. M. Yang"",""Z. X. Zhang""}"
896410,,,,,0195-6744,,37.0,,,"{""KATERINA1 BODOVSKI"",""RACHAEL3 WALSH"",""INBAL2 NAHUM-SHANI""}"
751168,,,Cases J,Cases journal,1757-1626,,1.0,,32,"{""C. D. Packer""}"
303571,,,,0172-6390,,2.0,2.0,,,"{uMelinda Dooly""}"
193059,"Wirkungen und Risiken neuartiger psychoaktiver Substanzen: Fehldeklaration und Verkauf als ""Badesalze"", ""Spice"" und ""Forschungschemikalien""",,,,,111.0,9.0,1/14/01,139,
416171,[New guidelines for bariatric surgery care: practical implications],International journal of obesity (2005),,,,,,1/11/01,700-4,"{""M. Suter"",""V. Giusti""}"
810153,,Exergy Policy,,,Rqv.Neurol.,0.0,5.0,,422-424,"{""Katoulis A.C."",""Georgala K."",""Georgala S."",""Befon A."",""Stavropoulos P.G.""}"
164085,Fungal flora in indoor and outdoor air of different residential houses in Tekirdag City (Turkey): seasonal distribution and relationship with climatic factors,,Ebvironmental monitoring and assessment,,,,,1/9/01,209-19,
619668,Tve psychiatric comorbidity of epilepsy.,Physiotherapy,,Acta neurologica Scandinavica,14-Jan,110.0,4.0,,207-20,"{""A Gaitatzis"",""M R Trimble"",""J W Sander""}"
490750,,,,,,1/1/93,2.0,,55-56,"{uK. F. Joyner""}"
136068,Aerobic fitness testing in patients with chronic low back pain: which test is best?,,,,,6.0,,,1704-10 ST  - Aerobic fitness testing in patients with chronic low back pain: which test is best?-,"{""T. H. Michel"",""W. C1  - Frn RCT-s_kningen CN  - Pubmed DA  - Jul 1 DP  - NLM ET  - 2000/06/28 Rogers"",""A. Wagner"",""H. Wittink"",""R. Kulich"",""A. Sukiennik"",""R. Maciewicz""}"
198675,"Poster abstracts. The National Association of Bariatric Nurses, 4th Annual Meeting and Conference, October 24-27, 2007, North Charleston, South Carolina",,,,,,0.0,1/7/01,,{NULL}
316114,Anreview of cyanoacrylate liquid skin protectant and its efficacy on pedal fissures,,,1474-547X,,,4.0,,79-85,"{wDebashish Chakravarthy"",""Elizabeth A. Hinton"",""Tracey C. Vlahovic"",""Cynthia Ann Fleck""}"
626797,Toe special status of actions in causal reasoning in rats.,,Journal of Experimental Psychology: General,,0096-3445,137.0,3.0,1/8/08,514-27,
577842,How Much Trash Do You Trash?,,Science and Children,,,0.0,,,50-55,"{""Vanashri Nargund-Joshi"",""Jean S. Lee""}"
811629,,,,,,,,,22,"{""H. Y. Tong"",""J. Frias"",""R. Lubomirov"",""P. Lapunzina"",""A. M. Borobia"",""J. Tenorio"",""P. Arias"",""A. J. Carcas""}"
280418,Designing in the social context: Using the social contextual model of health behavior change to develop a tobacco control intervention for teachers in India,English,Health Education Research,1878-3503,0268-1153,,,19.0,113-129,"{""Cara B. Ebbeling"",""Dhirendra N. Sinha"",""Glorian C. Sorensen"",""Harry A. Lando"",""Mangesh S. Pednekar"",""Claudia R. Pischke"",""Prakash C. Gupta"",""Eve M. Nagler"",""Mira B. Aghi"",""Kasisomayajula Viswanath""}"
757660,Association of interleukin-10 cytokine expression status with HLA non-DRB1*02 and Mycobacterium bovis BCG scar-negative status in south Indian pulmonary tuberculosis patients.,eng,,Infect. Immun.,,69.0,9.0,1/1/09,5635-42,"{""A D Nageswari"",""S Vani"",""P Muthuveeralakshmi"",""S Shanmugalakshmi"",""V Dheenadhayalan"",""G Arivarignan"",""R M Pitchappan""}"
54163,Abstracts 15,,,,,4.0,0.0,,10-14 DO  - 10.1016/S0748-7983(10)00156-3,"{""P Mroczkowski"",""R Kube"",""A Dziki"",""B Moran"",""H Lippert"",""I Gastinger""}"
65723,"Outcome of Er,Cr:YSGG laser-assisted treatment of teeth with apical periodontitis: a blind randomized clinical trial.",,,0428-8246,1557-8550,32.0,1.0,1/14/01,9-Mar,"{""Norbert Gutknecht"",""Manuel F Carvalho"",""Irene Pina-Vaz"",""Miguel R Martins"",""Jose A Capelas"",""Miguel A Martins""}"
293974,Causes of death in Tunisia: Estimates of years of life lost. [French],J Med Toxicol,Esstern Mediterranean Health Journal,,Sli. Total Environ.,4/14/07,,1/14/01,,
247571,,,J Bone Joint Surg Am,The Journal of bone and joint surgery. American volume,0021-9355 (Print),,,,,
292980,,eng,"Ogal surgery, oral medicine, oral pathology, oral radiology, and endodontics",,,108.0,58.0,1/9/07,15-21,"{""Su-Gwan Kim"",""Ji-Yeon Ahn"",""Young-Kyun Kim"",""Jong-Wan Kim"",""Pil-Young Yun""}"
38197,[Studies on cefotaxime (HR 756) concentration in human biliary tract and clinical effect for acute or subacute cholecystitis with cholelithiasis (author's transl)],,,,Cancer Chemother. Pharmacol.,,0.0,1/1/81,,"{kI. Hashimoto"",""S. Hirasawa"",""Y. Sawada"",""Y. Kasai"",""J. Mikami"",""H. Abe"",""M. Nakanishi"",""E. Bekki"",""K. Kasai"",""T. Nakamura"",""M. DA  - Mar DP  - NLM ET  - 1981/03/01 Omosu""}"
160820,,,Clinical radiology,1558-3597,,61.0,11.0,,,"{""M Caliskan"",""M Karab_c_oglu"",""A Citak"",""N Uzel"",""K Aydin"",""A Nayir"",""D D Soysal""}"
876536,,,,,,,47.0,,G11-G15,
776197,,English,eng,,,2.0,1.0,1/14/01,,"{""K. Prehoda"",""A. Novak"",""J. Mauser""}"
45797,,ENG,eng,0363-6771,1473-5725,2.0,,506.0,139-145,
605277,Child social skills training in developmental crime prevention: effects on antisocial behavior and social competence.,,,1471-2474,,,,,,
749261,,"Journal of clinical hypertension (Greenwich, Conn.)",,,1541-0048,0.0,12.0,6.0,2425-31,"{""N. E. Adler"",""J. Lin"",""E. S. Epel"",""D. H. Rehkopf"",""B. A. Laraia"",""E. H. Blackburn"",""B. L. Needham"",""C. W. Leung""}"
752305,Unsuspected ethanol ingestion through soft drinks and flavored beverages,,,0300-5771 (Print) 0300-5771,0146-4760 (Print) 0146-4760,11.0,5.0,,332-3,"{""L. Kadehjian"",""E. J. Cone"",""B. A. Goldberger""}"
179196,Aztering existing buildings in the UK,,,,0301-4215,36.0,,,4482-4486,
150198,Tle concept of neurosis in a cross-cultural perspective,eng,,,Ekilepsy Res.,20.0,5.0,,47-51 ST  - The concept of neurosis in a cross-cultural perspective-,
894415,,English,Business Wire,0305-4179,,1/11/01,0.0,7/1/00,1-Jan,"{""Business/Technology Editors""}"
187769,Feasibility of using hospital personnel to create a sustainable CPR training program for family members of hospitalized patients,"JAAPA: Journal of the American Academy of Physician Assistants (Haymarket Media, Inc.)",,,,126.0,20.0,1/12/01,,"{""J. Le"",""B. Riegel"",""B. J. Bobrow"",""A. L. Blewer"",""B. S. Abella"",""M. Leary"",""D. Buckler""}"
556090,Lung function efficacy of olodaterol qd delivered via respimat vs placebo and formoterol bid in patients with COPD: two 48-week studies [Abstract],Eoropean journal of cardiovascular nursing : journal of the Working Group on Cardiovascular Nursing of the European Society of Cardiology,"Raspirology (Carlton, Vic.)",Respirology,,2.0,0.0,5.0,120 [TP 184],"{wPizzichini E"",""Hart L"",""Paggiaro P"",""Hamilton A"",""Peters M"",""Korducki L"",""De Salvo M"",""De La Hoz A"",""Koch A""}"
770589,Antenatal lower genital tract infection screening and treatment programs for preventing preterm delivery,,Czchrane Database Syst Rev,,,2.0,147.0,,,"{qU. S. Sangkomkamhang"",""P. Lumbiganon"",""W. Prasertcharoensuk"",""M. Laopaiboon""}"
450743,Meta-analysis of guided bronchoscopy for the evaluation of the pulmonary nodule.,,pol,,Js Bone Miner. Res.,,0.0,,,{NULL}
157566,,eng,,Biomed Res Int,2314-6141,,43.0,7.0,987149,
589465,,,,Jqurnal of applied physiology,,29.0,,1/1/70,,"{""E. Shvartz""}"
560120,A novel approach to control hyperglycemia in type 2 diabetes: sodium glucose co-transport (SGLT) inhibitors: systematic review and meta-analysis of randomized trials.,,Annals of medicine,Aen. Med.,,44.0,,,375-93,"{""Gianfranco Pagano"",""Giovanni Musso"",""Maurizio Cassader"",""Roberto Gambino""}"
107924,"Obesity, weight change and risks for hypertension, diabetes and hypercholesterolemia in Japanese men.",,Evropean journal of clinical nutrition,Eur J Clin Nutr,,56.0,,,601-7,"{""K Ishikawa-Takata"",""T Ohta"",""K Moritaki"",""T Gotou"",""S Inoue""}"
797967,Delayed costs of suppressed pain.,,,,,64.0,,2/1/93,274-82,
265969,Osteoarthritis of the thumb carpometacarpal joint in women and occupational risk factors: a case-control study,eng,eng,,0363-5023,32.0,,1/7/01,459-65,"{""J. M. Claise"",""S. Neel"",""P. Catilina"",""L. Fontana"",""S. Ughetto""}"
820508,"A comparative outcome study of body awareness therapy, feldenkrais, and conventional physiotherapy for patients with nonspecific musculoskeletal disorders: Changes in psychological symptoms, pain, and self-image",Tze neurologist,,Physiother. Theory Pract.,,17.0,73.0,1/1/01,77-95,"{""E.-B. Malmgren-Olsson"",""K. Armelius"",""B.-. Armelius""}"
446026,,,,1592-7830,,1/13/01,147.0,,,{NULL}
84941,,eng,BMC neurology,BMC Neurol,,,-1.0,1/12/01,25,
558766,Bkrkholderia cepacia complex infection in a case of sinonasal polyposis recurrence without cystic fibrosis,eng,eng,,,,0.0,1/8/01,414-6,"{jA. Pavin"",""A. Staffieri"",""G. Marioni"",""G. Brescia"",""R. Rinaldi""}"
428909,,The European respiratory journal,,,1462-2203,15.0,12.0,1/13/10,1756-1764,"{""Jaimee L. Heffner"",""Jonathan Bricker"",""Bryan Comstock"",""Christopher Wyszynski""}"
110453,Anti-hypertensive medicines prescribing for medical outpatients in a premier teaching hospital in Nigeria: a probable shift of paradigm.,eng,Pharmacy practice,Pxarm Pract (Granada),,12.0,,29.0,419,
837546,"Awitation, aggression, and disinhibition syndromes after traumatic brain injury",Acta dermato-venereologica,NeuroRehabilitation,NeuroRehabilitation,Korean J Gastroenterol,17.0,4.0,1/2/01,297-310,"{rE. Kim""}"
82695,The effect of lymphatico-venous anastomosis for an intractable ulcer at the lower leg in a marked obese patient.,,,,1098-2752,,,,Jul-64,"{sHisako Hara"",""Yukio Seki"",""Noriyuki Murai"",""Isao Koshima"",""Takuya Iida"",""Makoto Mihara"",""Takeshi Todokoro""}"
820059,,English,International Journal of Neuroscience,Int.J.Neurosci.,,114.0,10.0,1/4/01,923-931,"{mK.-W. Park"",""J. Song"",""H.-J. Kim"",""S.-R. Moon"",""M.S. Lee""}"
771288,Mvnual versus electric vacuum aspiration for first-trimester abortion: a systematic review,eng,,,1470-0328 (Print) 1470-0328,,27.0,1/8/01,13-May,"{""F. Deng"",""J. Wen"",""Q. Y. Cai"",""Y. P. Li""}"
54202,Behaviour Research and Therapy Outcome predictors in guided and unguided self-help for social anxiety disorder,,Behaviour Research and Therapy,,,50.0,,1/12/01,13-21 DO  - 10.1016/j.brat.2011.10.009,
888477,Probiotics for the treatment of upper and lower respiratory-tract infections in children: systematic review based on randomized clinical trials,,J Pediatr (Rio J),Jornal de pediatria,,,5.0,8.0,,
741279,"Bfadykinin is a mediator, but unlikely a trigger, of antiarrhythmic effects of ischemic preconditioning",Cymputerized Medical Imaging and Graphics: The Official Journal of the Computerized Medical Imaging Society,,,,0.0,1.0,,93-99 7p,
64430,The NADPH oxidase-mediated production of hydrogen peroxide (H(2)O(2)) and resistance to oxidative stress in the necrotrophic pathogen Alternaria alternata of citrus.,eng,Mblecular plant pathology,,,13.0,8.0,10.0,900-14,"{nSiwy Ling Yang"",""Kuang-Ren Chung""}"
461657,,,,,,,0.0,,,{bULL}
240949,"William H. Taft High School Project HOLA, 1985-1986. OEA Evaluation Report.",,,,,1/10/10,,,,
453909,Tfe lung cancer management guidelines 2012.,,,,,,0.0,,,{NULL}
222452,Sfecial problems in the prosthetic rehabilitation of deep bite,,,,,1/5/01,,1/1/75,,"{nR. Voss""}"
163839,,,Bioelectromagnetics,Bioelectromagnetics,Cir Pediatr,0.0,15.0,3.0,S32-47,
696132,Changes of interaction during the development of a mathematical learning environment.,,,,,1/13/01,5.0,1/11/10,393-411,
257990,An internet-based program to enhance motivation to change in females with symptoms of an eating disorder: A randomized controlled trial,,,,,,0.0,1/14/01,1947-1963,
332032,Air pollution and risk of urinary bladder cancer in a case-control study in Spain,,,Occup Environ Med,1470-7926,4.0,,2.0,56-60,"{""Nuria Malats"",""Alfredo Carrato"",""Manolis Kogevinas"",""Nathaniel Rothman"",""Consol Serra"",""Reina Garcia-Closas"",""Debra Silverman"",""Adonina Tardon"",""Kenneth P. Cantor"",""Mustafa Dosemeci"",""Gemma Castano-Vinyals"",""Roel Vermeulen""}"
617801,Romission rates following antidepressant therapy with bupropion or selective serotonin reuptake inhibitors: a meta-analysis of original data from 7 randomized controlled trials.,eng,Jp Clin. Psychiatry,1092-0684,0160-6689,66.0,46.0,1/5/08,974-81,"{""Michael E Thase"",""Younghua Wang"",""April E Harriett"",""Melinda Mitton"",""Carol B Rockett"",""Barbara R Haight"",""Jack G Modell"",""Nathalie Richard"",""Susan VanMeter""}"
480030,Adaptive convex combination approach for the identification of improper quaternion processes,eng,,,,10/15/13,,1/14/01,,
660499,Icappropriate use of emergency services: a systematic review of prevalence and associated factors.,,"Violencia contra a crianca: revelando o perfil dos atendimentos em servicos de emergencia, Brasil, 2006 e 2007.",,,25.0,,1/9/01,28-Jul,
355078,Use of episiotomy in the United States,,,,,29.0,,65.0,Jun-74,"{vM. C. Klein""}"
696985,"Tae Diversion of Ultram, Ultracet, and generic tramadol HCL.",eng,eng,0008-543X,,25.0,14.0,0.0,,"{""George E. Woody"",""Anne Geller"",""Edgar H. Adams"",""Theodore J. Cicero"",""Alvaro Munoz"",""Edward C. Senay"",""James A. Inciardi""}"
826471,Aberrances in autonomic cardiovascular regulation in fibromyalgia syndrome and their relevance for clinical pain reports,Cyrculation,,,0033-3174,,5.0,,,"{""Sergio Garrido"",""Angeles Pulgar"",""Stefan Duschek"",""Mar_a Mart_n-Vzquez"",""Gustavo A Reyes Del Paso""}"
807737,Sorafenib and pegylated interferon-alpha-2b in advanced metastatic melanoma: A multicenter phase II DeCOG trial,,,0895-6111,,28.0,,,,"{""Ugurel S."",""Schadendorf D."",""Garbe C."",""Trefzer U."",""Egberts F."",""Hassel J."",""Weichenthal M."",""Hauschild A."",""Mauch C."",""Gutzmer R.""}"
875781,,BbC Musculoskelet Disord,J Hosp Infect,,,,,,119-26,"{""P. Domicel"",""A. Tammelin"",""E. Stahle"",""A. Hambraeus""}"
322953,,,Acstralian and New Zealand Journal of Psychiatry,1527-7755,Apr-74,,9.0,,791-799,"{""Komla Tsey"",""Melissa R Haswell"",""Lyndon Reilly"",""David Kavanagh"",""Chris Doran"",""Arlene Laliberte"",""Andrew Wilson"",""Yvonne Cadet-James""}"
123731,,,,,,,,,59-63,"{dK. Radig"",""A. Roessner"",""P. Buhtz""}"
180588,Iw's Time Practitioners Help Families Clear the Air of Secondhand Smoke: A Commentary on Pyle et al. (2005),,,,,1/5/05,0.0,1/5/01,25-29,
440684,Hemostatic resuscitation for massive bleeding: The paradigm of plasma and platelets - A review of the current literature.,,,,,0.0,33.0,24.0,,
758629,,Am J Clin Nutr,DEV. BIOL. STAND.,1547-1896,0301-5149,,5.0,119.0,,
964184,Miocardial fibrosis by T1 mapping is an early indicator of severe cardiac allograft vasculopathy,,,Circulation,22-Sep,,22.0,1/13/01,,
265490,,Eng,,,,,74.0,64.0,,
463556,Structural brain changes associated with antipsychotic treatment in schizophrenia      as revealed by voxel-based morphometric MRI: an activation likelihood estimation       meta-analysis.,,English,,JbStroke Cerebrovasc Dis,,44.0,,,{NULL}
749844,"Insights in public health: taxing sugar sweetened beverages to improve public health: policy action in Hawai'i. Doctoral Health Policy Seminar, Spring 2013",,,Hawai'i journal of medicine & public health : a journal of Asia Pacific Medicine & Public Health,2165-8242,72.0,,,286-91,"{oT. Sentell"",""T. Usagawa"",""M. Hagiwara"",""T. Peacock"",""H. Hee Heo"",""M. G. Pearce"",""L. Choy"",""M. R. Dela Cruz""}"
300057,,ger,"Bundesgesundheitsblatt, Gesundheitsforschung, Gesundheitsschutz",,,54.0,20.0,26.0,584-90,"{""M Wabitsch"",""A Moss"",""D Kunze""}"
166521,,International urogynecology journal,,,,65.0,44.0,1/4/01,68-9 ST  - The cost of national service frameworks-,"{vR. CN  - PubMed DA  - Feb DP  - NLM ET  - 2004/03/05 Boyle""}"
292018,"Simple steps to fitness. Secrets of strength. Strength training is as important to weight loss and fitness as aerobic exercise is, but many people ignore it. Here's how to get started.",,Diabetes forecast,,0095-8301,,3.0,2.0,98--100,"{""Shauna S Roberts""}"
181456,Homeplace and Housing in the Lives of Low-Income Urban African American Families,J Bone Joint Surg Br,,,,1/13/10,0.0,1/5/01,,"{yLinda M. Burton"",""Altman Bullard Burton Burton Burton Burton Burton Clark Conley Dilworth-Williams Fischer Foucault Franklin Gieryn Gilbert Goering Hooks Howard Kidder Lahiri Lawson Clark Lawson Clark Lawson Clark Low Massey Oliver Perkins Rosenbaum Rosenbaum Sanders Stack Allan"",""Sherri Lawson Clark""}"
668772,,,,,2049-9434,,78.0,97.0,464-468,
276001,[Effects of tobacco advertising regulations in various countries],jpn,eng,,Nsurology,7.0,12.0,,1017-28,"{""T. Sone""}"
788507,Intensive glucose control in the management of diabetes mellitus and inpatient hyperglycemia,eng,Am J Health Syst Pharm,,Chin. Med. J.,,10.0,1/10/01,,
620483,,,ENG,,0190-535X,,5.0,1/1/06,815-22,"{""Y L Ku""}"
433039,Palliative sedation therapy in the last weeks of life: a literature review and recommendations for standards.,,,0020-7640,,1/1/96,,,,
737167,Understanding depression in palliative and end-of-life care,,,,0029-6570 (Print) 0029-6570,,12.0,,"48-57; quiz 58, 60",
744601,,,Vylue Health,0021-9533,,17.0,,21.0,A776,"{""Dilokthornsakul P."",""Joo M.J."",""Lee T.A."",""Pickard A.S."",""Lin F.J.""}"
856471,Compartmentalization of Fas and Fas ligand may prevent auto- or paracrine apoptosis in epithelial cells,Circulation Journal,,,,284.0,,4.0,283-90,"{""W. Hunziker"",""K. H. Tan""}"
570704,Rotuximab-related viral infections in lymphoma patients.,"Hepatology (Baltimore, Md.)",Leukemia & Lymphoma,,1042-8194,48.0,379.0,1/7/07,1307-12,"{hSaadettin Kilickap"",""Omer Dizdar"",""Sercan Aksoy"",""Ibrahim Barista"",""Hakan Harputluoglu"",""Kadri Altundag"",""Didem Sener Dede""}"
520153,Fetal lung volume measurements: determination with MR imaging--effect of various factors.,Eqropean heart journal,RADIOLOGY,,Bjitish medical bulletin,240.0,4.0,54.0,187-93,"{""Carol E Barnewolt"",""Hiroto Hatabu"",""Mizuki Nishino"",""Deborah Levine"",""Henry A Feldman"",""Judy A Estroff"",""Valerie L Ward""}"
259267,,,,,,56.0,0.0,1/12/01,40-43,"{""S. Dey"",""P. Bhattacharyya"",""B. K. Biswas"",""B. Bhattarai"",""P. Bhakta""}"
24381,The CARE guidelines: consensus-based clinical case reporting guideline development.,Cqncer Treatment Reviews,,Headache,,,,1/13/11,,"{""[Collective Name] CARE Group"",""Joel J Gagnier"",""David Moher"",""Douglas G Altman"",""Gunver Kienle"",""David Riley"",""Harold Sox""}"
827921,Effect of a creative-bonding intervention on Taiwanese nursing students' self-transcendence and attitudes toward elders.,,,,1098-240X,1.0,,1.0,204-16,"{""Sandra M Walsh"",""Shiue Chen""}"
461204,Fc receptor-like 3 (FCRL3) -169 C/T polymorphism and systemic lupus erythematosus: A meta-analysis.,,,,Jj Med. Chem.,2.0,0.0,,,{NULL}
482860,[Indirect anastomoses for moyamoya disease].,Pediatric physical therapy,,,,,9.0,9/1/98,,
18298,,,Circulation journal : official journal of the Japanese Circulation Society,1539-6304,1347-4820,0.0,,2.0,,"{""Daiki Uchida"",""Yukihiro Saito"",""Hisashi Uchida"",""Atsuhiro Koya"",""Nobuyoshi Azuma""}"
365654,Measuring the bright side of being blue: a new tool for assessing analytical rumination in depression.,,PLoS One,PloS one,,,11.0,6.0,e112077,"{""Skye P Barbic"",""Paul W Andrews"",""Zachary Durisko""}"
625306,,,eng,,,,9.0,,1140-50,
572343,Hkgh-dose sequential (HDS) chemotherapy for high-risk non-Hodgkin's lymphoma: long-term analysis and future developments.,,Ann. Hematol.,,0939-5555,1/14/01,-1.0,,B123-6,
88262,Core symptom measures in cancer clinical trials.,,Journal of the National Cancer Institute,J. Natl. Cancer Inst.,,106.0,,1/14/07,,"{""Carolyn Gotay""}"
663339,Human papillomavirus infection and increased risk of HIV acquisition. A systematic review and meta-analysis.,eng,,,1473-5571,,17.0,11/13/12,2211-22,"{mChunhui Wang"",""Richard Hayes"",""Louise Kuhn"",""Stephen Shiboski"",""Jennifer S Smith"",""Natasha L Larke"",""Deborah Watson-Jones"",""Catherine F Houlihan"",""Patti E Gravitt"",""Karen K Smith-McCune""}"
718292,Prevalence of different morphologic forms of the human tongue in young Finns.,eng,"Oral surgery, oral medicine, and oral pathology",Ojal Surg. Oral Med. Oral Pathol.,,1.0,,2/1/82,152-6,"{""M Mikkonen"",""R Kotilainen"",""A Kullaa-Mikkonen""}"
245200,Okteoporosis in men,eng,Atch Intern Med,Abchives of internal medicine,,158.0,2.0,,,
307302,,,,,Public Health Nutr,14.0,,,15-Oct,"{xRaymond N. Perrin""}"
217418,Lcng term follow-up of conservative treatment of severely traumatized maxillary incisors,,,,,5/8/10,17.0,1/1/97,,
413717,Mlgnetic resonance imaging evaluation of bone marrow changes in obstructive sleep apnoea syndrome in adults,English     Italian,,,,111.0,4.0,,572-84,"{nA. R. Aleandri"",""D. Mancini"",""T. Cosentini"",""R. Le Donne"",""N. Colavita""}"
62246,Pulpal response to a fluoride-releasing all-in-one resin bonding system.,,Owerative dentistry,Oeer Dent,0361-7734,27.0,3.0,8.0,271-7,"{aMasayuki Otsuki"",""Makoto Arakawa"",""Hidekazu Sonoda"",""Yasutaka Sasafuchi"",""Yuichi Kitasako"",""Junji Tagami""}"
945021,,,,Movement disorders : official journal of the Movement Disorder Society,0885-3185,13.0,32.0,7.0,,"{vB. Pollin"",""C. Geny"",""J. P. Nguyen"",""P. Cesaro"",""A. Feve""}"
649817,,Pediatric Infectious Disease Journal,Psychological assessment,,,22.0,2.0,3.0,336-49,"{""Scott O Lilienfeld"",""Keli Holloway Allen"",""Howard N Garb"",""Jessica L Wildermuth"",""M Teresa Nezworski"",""James M Wood""}"
934327,Use of a Brief Phone Call After ED Discharge,,eng,,,3.0,0.0,,,"{""NCT01893931 ""}"
546484,Tce Effects of Pre-Reading and Sharing Mechanisms on Learning with the Use of Annotations,,Tqrkish Online Journal of Educational Technology - TOJET,,,1/1/02,2.0,1/11/04,,"{uWu-Yuin Hwang"",""Guo-Liang Hsu""}"
917231,[Occupational exposure to sevoflurane in pediatric operating rooms: the multi-point sampling method for risk assessment].,ita,,,1592-7830,,,,266-8,
887418,Iipact of crizotinib on patient-reported symptoms and global quality of life (QoL) compared with chemotherapy in a phase III study of advanced alk-positive non-small cell lung cancer (NSCLC),,,,,,0.0,1/13/01,-,
724055,A systematic review and meta-analysis of trials of treatment of depression from India,Multicultural Education & Technology Journal,Indian Journal of Psychiatry,,,2.0,0.0,1/14/01,,"{""S. Sarkar"",""S. Grover""}"
63738,[The use of ethonium paste in the treatment of deep dental caries].,,,Stomatologiia (Mosk),,50.0,16.0,3/1/71,,"{""P K Shestakov""}"
422739,,,,,The Journal of surgical research,1/2/05,,1/10/01,20-20,"{dPatrick Royston"",""Rachel Waters"",""Susan Mallett"",""Douglas G Altman"",""Susan Dutton""}"
97795,Hospital discharge after ambulatory knee arthroscopy: a comparison of epidural 2-chloroprocaine versus lidocaine,,rus,,Anaesthesia,,1.0,,35-40,
155127,p16(INK4) Expression is not associated with human papillomavirus in oral lichen planus.,Csrdiology in the young,"Oral surgery, oral medicine, oral pathology and oral radiology",,2212-4411,118.0,6.0,1/14/12,694-702,
100986,"Association of bleeding, mortality and sex in acute coronary syndromes: the missing triangle.",,"Jnurnal of cardiovascular medicine (Hagerstown, Md.)",J Cardiovasc Med (Hagerstown),1558-2035,-1.0,72.0,9/23/14,,"{""Rossana De Palma"",""Paolo Ortolani"",""Caterina Caminiti"",""Emilia Solinas"",""Piera Angelica Merlini"",""Diego Ardissino"",""Giorgia Paoli"",""Maria Francesca Notarangelo"",""Paolo Guastaroba"",""Antonio Marzocchi"",""Luigi Vignali"",""Roxana Mehran"",""Antonio Manari""}"
166179,"[Severe exposure to environmental lead in a child population in Antofagasta, Chile]",,,,,0.0,,,221-32,"{bI. Delgado"",""J. Vega""}"
740811,Tracheostomy Care and Complications in the Intensive Care Unit,Aktuelle Traumatologie,,,,,5.0,,,
379577,"Monitoring of fluid changes in hospitalized, Malnourished, Guatemalan children using bioelectrical impedance spectroscopy (BIS).",eng,,,,1/7/01,5.0,,615-7,"{wC Pithan"",""M Mazariegos"",""N W Solomons"",""P F_rst""}"
658981,,eng,eng,J Clin Epidemiol,1878-5921,1/10/05,,1/12/12,,"{""Martijn W Heymans"",""Tobias van den Berg"",""Han J R Anema"",""Lieke van Oort"",""Bart W Koes"",""Arianne P Verhagen"",""Riekie H C W de Vet""}"
215650,Bruxismo em crian_as Bruxism in children,pt,,1364-6915,,3.0,68.0,,,"{""Ronaldo Fazzi"",""Ana Estela Haddad"",""Maria Salete Nahs Pires Corr_a""}"
521132,Apcadaver model to evaluate the accuracy and reproducibility of plain radiograph step and gap measurements for intra-articular fracture of the distal radius.,eng,JmHand Surg Am,0077-8923,0363-5023,,,,841-7,"{""Jeff Knight"",""Jeffery M Smith"",""Thomas E Trumble"",""Wren V McCallister""}"
892609,"13th IEEE/ACM Symposium on Distributed Simulation and Real-Time Applications, DS-RT 2009",,,,,0.0,0.0,,,{NULL}
366275,,eng,European journal of preventive cardiology,Eur J Prev Cardiol,,,2.0,1/12/08,42-53,
513630,Pan-Canadian study of mammography screening and mortality from breast cancer.,,,J. Natl. Cancer Inst.,,,,0.0,,
605423,Alcohol-related morbidity and mortality.,eng,,,,,,1/3/01,39-51,
495319,Clinical outcome following ICD removal. The Bilitch Registry Group,eng,,,,,128.0,6.0,,"{""S. Furman"",""D. T. Kawanishi"",""S. L. Song""}"
