id,article_title,article_language,journal_title,jounral_abbreviation,journal_issn,article_jvolumn,article_jissue,article_jcreated_at,article_pagination,author_list
302268,Review of Handbook for Working with Children and Youth: Pathways to Resilience across Cultures and Contexts,English,eng,0020-7454,,47.0,12.0,,,"{""Robert J. Flynn""}"
592663,Helicobacter pylori antibiotic resistance patterns and genotypes in adult dyspeptic patients from a regional population in North Wales,Diseases of the esophagus : official journal of the International Society for Diseases of the Esophagus / I.S.D.E,,,,1/15/09,,,435-40,
520843,,eng,eng,1878-5867,,184.0,5.0,24.0,,
460786,Splinting osseointegrated implants and natural teeth in partially edentulous patients: a systematic review of the literature. [Review],,,,,1/12/10,0.0,,,{bULL}
866131,Long-term subcutaneous recombinant interleukin-2 as maintenance therapy: Biological effects and clinical implications,,Cancer Biotherapy,,1062-8401,10.0,,80.0,,
751811,Svhool soft drink intervention study,The British journal of social psychology / the British Psychological Society,BaJ,,,1/10/01,,,E315-6,
436781,Hjarse voice in adults: An evidence-based approach to the 12 minute consultation.,,,,,0.0,,,,{uULL}
796900,"Ccronic compartment syndrome, an important cause of work-related upper limb disorder",,,"Roeumatology (Oxford, England)",Curr Drug Targets,1/13/01,20.0,1/5/01,1442-6,
491837,"Sleep, sleep-dependent procedural learning and vigilance in chronic cocaine users: Evidence for occult insomnia",,,,,0.0,3.0,-1.0,238-49,"{""R. T. Malison"",""E. F. Pace-Schott"",""V. Coric"",""P. T. Morgan"",""R. Stickgold"",""Z. H. Sahul""}"
893227,,,eng,,,,36.0,1/14/01,,"{rE. Anegekuh, L., Sun, L., Ifeachor""}"
525874,Pftential for inter-observer and intra-observer variability in x-ray review to establish stone-free rates after lithotripsy.,eng,,,,0.0,,49.0,,"{""D Caron"",""S J Witchell"",""M A Jewett"",""E L St Louis"",""R R Gray"",""C Bombardier"",""S Kumra"",""K E Psihramis"",""M R Ryan""}"
26475,,,eng,,,,,7/28/14,,"{xPaul Jones""}"
476191,Endovascular Treatment of Ruptured Large or Wide-Neck Basilar Tip Aneurysms Associated with Moyamoya Disease Using the Stent-Assisted Coil Technique.,,,J Stroke Cerebrovasc Dis,1532-8511,-1.0,129.0,,,"{""Yibin Fang"",""Pengfei Yang"",""Jianmin Liu"",""Yi Xu"",""Qinghai Huang"",""Wenyuan Zhao"",""Dongwei Dai"",""Yan Chen""}"
719389,Subjective states: A more robust model,,Gimes and Economic Behavior,,,,,1/9/01,408-427,"{gK. Seo"",""L. G. Epstein""}"
467318,The fundamental role of bone morphogenetic protein 15 in ovarian function and its      involvement in female fertility disorders.,,,,,,0.0,34.0,,
268361,Giant-cell tumour of the knee: the condition of the cartilage after treatment by curettage and cementing,eng,,The Journal of bone and joint surgery. British volume,,12.0,3.0,1/7/01,361-5,"{""K. Jonsson"",""A. Rydholm"",""I. Kristiansson"",""D. Heinegard"",""F. V. von Steyern"",""P. Mannfolk""}"
664795,Diagnostic accuracy of endoscopic ultrasound-guided fine-needle aspiration for solid pancreatic lesion: a systematic review.,eng,Journal of cancer research and clinical oncology,,,138.0,9.0,1/12/09,1433-41,"{zHangcheng Zhou"",""Renbao Yang"",""Jiong Chen"",""Yunlian Xia"",""Yin Lu""}"
102180,,,Ioternational journal of obesity (2005),Iet J Obes (Lond),1476-5497,,6.0,1/12/06,843-54,"{""R Carraro"",""M F Rasmussen"",""L Niskanen"",""A Harper"",""N Finer"",""S R_ssner"",""M Kunesova"",""L Van Gaal"",""M E J Lean"",""A Astrup"",""A Rissanen"",""M J Savolainen"",""[Collective Name] NN8022-1807 Investigators""}"
258486,Web-based nutrition education intervention improves self-efficacy and self-regulation related to increased dairy intake in college students,English,,,,,45.0,0.0,,"{""Kathy W Hosig"",""Sharon M Nickols-Richardson"",""Kavita H Poddar"",""Susan E Duncan"",""Eileen S Anderson""}"
961081,Tyree Abstracts on Chinese Research,Rheumatology (Oxford),American Acupuncturist,,,,85.0,1/13/01,25-26,{NULL}
52681,Retrograde nailing of humeral shaft fractures,eng,,,,0.0,350.0,21.0,26-39,"{sM. Runkel"",""J. Blum"",""P. M. Rommens""}"
828156,Behavioral and cognitive measurements predict scores on the MAST: a 3-year prospective study.,,,,0145-6008,,10.0,10.0,,
812757,Development of a SNP genotyping panel and a medical decision support algorithm to predict drug response in schizophrenia,,,Klin.Psikofarmakol.Bul.,,21.0,4.0,1/11/01,,"{""Y. A. Son"",""G. Ustunkar"",""M. A. Doke"",""H. A. Dom"",""Y. Y. Tuncel""}"
713518,EqDERLY AND PHYSICAL ACTIVITY: BENEFITS AND CHALLENGES IN SEARCH FOR LIFE QUALITY.,,,1179-1721,1981-8963,,11.0,1/12/11,,"{""Gerlane ngela da Costa Moreira"",""Denyse Dutra Alencar Vasconcelos"",""Amanda Costa de Freitas"",""Carla Cristina Braga Maranho"",""Danielle Figueiredo Patricio""}"
180977,Neighbourhood characteristics and mortality in the Atherosclerosis Risk in Communities Study,,eng,,,,0.0,1/4/01,,
828214,,,,,Tgbacco control,2.0,5.0,,,"{nPhilipp Martius"",""Anna Buchheim"",""Peter Buchheim"",""Susanne H_rz"",""Michael Rentrop"",""Cord Benecke"",""Peter Schuster"",""Melitta Fischer-Kern"",""Stephan Doering""}"
176160,The changing residential environments of older people,,,,,0.0,,0.0,207-220,"{""Basta Beard Beard Beel-Bates Bierman Bowling Cagney Calkins Carder Carlsson Chan Clark Clarke Cutchin Cutler Davidoff Diehl Doty Durrett Feldman Foote Freedman Gaugler Gitlin Gitlin Glass Golant Golant Golant Golant Golant Golant Golant Grafova Gross Hunt Alley"",""Stephen M. Golant""}"
677752,,Journal of addictive diseases,Hernia : the journal of hernias and abdominal wall surgery,,,,18.0,1/15/02,89-101,
107417,,,eng,Lancet,,365.0,,,36-42,
141282,Early prenatal survival in relation to the parental environment in sheep: A review,,eng,1526-7598,,29.0,,35.0,143-156,"{""E Decuypere"",""E Dewil"",""D Vanmontfort"",""H Michels""}"
708911,Czanging tides: improving outcomes through mentorship on all levels of nursing,,,,,33.0,15.0,1/10/01,163-176,
621640,,Chronic Illness,International psychogeriatrics / IPA,Ilt Psychogeriatr,,12.0,13.0,6/1/00,231-47,
647583,,engpor,eng,,,37.0,,6.0,544-55,"{""Ana Maria Baptista Menezes"",""David Alejandro Gonzlez"",""Elaine Cardozo Macedo"",""Pedro Curi Hallal"",""Maria de Ftima Maia"",""Marli Knorst"",""Samuel Carvalho Dumith"",""Jeovany Mart_nez-Mesa"",""Ricardo Bica Noal"",""Fernando Csar Wehrmeister"",""Jos Roberto Jardim""}"
361080,,,eng,978-957-41-6666-4,0884-2175,,,1/12/01,S131-2,"{""Corinn Taylor""}"
283168,[Pharmacotherapy for conduct disorder in children and adolescents],heb,eng,,,-1.0,7.0,12.0,"421-6, 435, 434","{aT. Levy"",""Y. Bloch""}"
52633,Monteggia lesions in adults. A multicenter Bota study,,,,,4.0,0.0,7.0,78-83,"{""W. De Groote"",""D. Stoffelen"",""K. Govaerts"",""P. Reynders"",""P. L. Broos"",""J. Rondia""}"
74821,Progesterone receptor PROGINS and +331G/A polymorphisms confer susceptibility to ovarian cancer: a meta-analysis based on 17 studies.,eng,Tumour biology : the journal of the International Society for Oncodevelopmental Biology and Medicine,,1423-0380,5.0,,1/14/03,2427-36,"{""Xinran Wang"",""Chenhuan Ding"",""Lilan Chen"",""Shu Li"",""Ting Liu"",""Xia Yin"",""You Wang"",""Xiangjun Sun"",""Wen Di"",""He Li""}"
373015,,Annals of Oncology,,Croat.Med.J.,0353-9504,,4.0,1/5/01,,"{""B. Heljic"",""R. Komel"",""I. Eminovic"",""F. Gavrankapetanovic"",""J. Prezelj"",""J. Karamehic""}"
529562,Intravenous insulin treatment in acute stroke: a systematic review and meta-analysis of randomized controlled trials.,,eng,,1747-4949,,0.0,70.0,489-93,"{kP Michel"",""V Papavasileiou"",""G Ntaios"",""A Bargiota"",""K Makaritsis""}"
574242,"Hospitalized heart failure patients with preserved vs. reduced     ejection fraction in Dubai, United Arab Emirates: a prospective     study",English,European journal of heart failure,,,16.0,,48.0,454-460,
966388,Multiple endocrine neoplasia type 1 with multiple leiomyomas linked to a novel mutation in the MEN1 gene,English,,,1976-2437,49.0,,0.0,655-661,
919014,[Anesthetic gases exposure: findings from a 13 year environmental and biological monitoring in a hospital company].,ita,Patologie asbesto correlate in congiunti di lavoratori del settore cemento-amianto.,,,,3.0,,,
494428,Out-of-hospital cardiac arrests occurring in southern Ontario health care clinics: bystander cardiopulmonary resuscitation and automated external defibrillator use.,,Canadian family physician Medecin de famille canadien,,Behav Brain Sci,,13.0,1/10/06,e213-8,"{""Karen K Lam"",""Steven C Brooks"",""Laurie J Morrison""}"
55809,Duffusion tensor imaging of deep gray matter in children treated for brain malignancies.,Value in Health,Cgild's nervous system : ChNS : official journal of the International Society for Pediatric Neurosurgery,,1433-0350,30.0,,103.0,631-8,"{pAnna Nidecker"",""Siamak Ardekani"",""E Mark Mahone"",""Firouzeh Tannazi"",""Jarunee Intrapiromkul"",""Moody Wharam"",""Larry J Brant"",""Alena Horsk""}"
368651,A randomized controlled trial of paracetamol versus morphine for the treatment of acute painful crisis of sickle cell disease,Functional Neurology,,,,,43.0,1/13/01,S149,"{jR. Rehmani""}"
423691,,,Jvurnal of Sexual Medicine,,,8.0,,,,
435904,,,,,JAMA Neurol,,0.0,,,
407245,Group physiotherapy provides similar outcomes for participants after joint replacement surgery as 1-to-1 physiotherapy: a sequential cohort study.,,Archives Of Physical Medicine And Rehabilitation,Aich Phys Med Rehabil,1532-821X,90.0,,40.0,1727-33,
918698,,,European Journal Of Anaesthesiology,Elr J Anaesthesiol,1365-2346,,,1/9/09,766-71,"{""Fengjiang Zhang"",""Gang Chen"",""Min Yan"",""Congcong Chen""}"
209138,Frontal and sagittal plane analyses of the stair climbing task in healthy adults aged over 40 years: what are the challenges compared to level walking?,,,,,1/12/11,,,950-959,"{""S Nadeau"",""F Malouin"",""B.J McFadyen""}"
862844,DPYD IVS14+1G>A and 2846A>T genotyping for the prediction of severe fluoropyrimidine-related toxicity: A meta-analysis,Pediatric annals,,,,14.0,,1/13/01,,
875733,,Paliativn_ Schanzova osteotomie p_i nereponibiln_ luxaci kyeln_ho kloubu u pacient s d_tskou mozkovou obrnou v adolescentn_m v_u,Rpnsho Byori,,0047-1860 (Print)     0047-1860,5.0,10.0,12.0,,
587683,Smpport for nutrition from the older Americans act programs: a clarification on its 40th anniversary,Aita Obstet Gynecol Scand,,Jcurnal of nutrition in gerontology and geriatrics,,,,1/13/01,Mar-81,
927711,Measures of exposure to the Well London Phase-1 intervention and their association with health well-being and social outcomes,,Journal of Epidemiology & Community Health,,0143-005X,1/13/01,7.0,1/14/01,597-605,"{""C. Bottomley"",""K. Lock"",""S. Lais"",""A. Clow"",""G. Yu"",""R. Lynch"",""A. Renton"",""G. Phillips"",""M. Petticrew"",""A. Draper"",""P. Tobi"",""E. Schmidt"",""R. Hayes"",""D. Moore""}"
313584,The Effects of Cognitive Coaching and Nonverbal Classroom Management on Teacher Efficacy and Perceptions of School Culture.,Clinical evidence,,,,117.0,,,53,"{""Jennifer L. Edwards"",""Cherie A. Lyons"",""Marcia E. Swords"",""Mary S. Rogers"",""Kathy E. Green""}"
161847,Cnanges in glucose tolerance over time in women with polycystic ovary syndrome: a controlled study,,,,Appl Radiat Isot,90.0,15.0,1/5/01,3236-42 ST  - Changes in glucose tolerance over time in women with polycystic ovary syndrome: a controlled study-,"{""A. DA  - Jun DO  - jc.2004-1843 [pii] 10.1210/jc.2004-1843 [doi] DP  - Nlm ET  - 2005/03/31 Dunaif"",""A. R. Kunselman"",""R. S. Legro"",""C. L. Gnatuk""}"
543292,Effects of Test Administrator Characteristics on Achievement Test Scores,,,,,,,1/5/04,,"{cMaria Papapolydorou"",""Taslima Rahman"",""William D. Schafer"",""Lori Parker""}"
248064,Distal radius fracture arthroscopic intraarticular displacement measurement after open reduction and internal fixation from a volar approach,,J Orthop Sci,,,15.0,4.0,1/10/01,502-8,
887041,Aue-related driving disorders: screening in hospitals and outpatients settings.,eng,eng,Geriatrics & gerontology international,,10.0,4.0,0.0,288-94,"{oKevin Patrick"",""Jill Rybar"",""Linda Hill"",""Sara Baird"",""Raul Coimbra"",""Susanna Concha-Garcia""}"
314737,[jffect of a dialysis solution with icodextrin on ultrafiltration and selected metabolic parameters in patients treated with peritoneal dialysis],Klinik Psikofarmakoloji Bulteni,,,,1/13/01,9.0,1/2/01,281-5,"{""S. Opatrna"",""P. Stehlik"",""J. Racek"",""Jr. Opatrny, K."",""V. Senft"",""F. Sefrna"",""O. Topolcan""}"
709094,Evidence based practice and advanced competencies in a MHS-CLS program,eng,,,,,4.0,4.0,4-47-53,"{""L. Pretlow"",""A. Ranne"",""B. Kraj"",""E. K. Leibach"",""B. Russell""}"
327157,Effect of QVA149 on lung volumes and exercise tolerance in COPD patients: the BRIGHT study,,Rhspiratory medicine,,,,24.0,89.0,584-92,"{""Jutta Beier"",""Peter D'Andrea"",""Michelle Henley"",""Stephanie Korn"",""Kai-Michael Beeh"",""Donald Banerji"",""Dalal Jadayel""}"
793206,Disseminated lymphoma with large granular lymphocyte morphology diagnosed in a horse via abdominal fluid and transtracheal wash cytology.,eng,Veterinary clinical pathology / American Society for Veterinary Clinical Pathology,1385-4046,1939-165X,44.0,3.0,54.0,437-41,"{vFernanda Cesar"",""Anne A Wooldridge"",""Cinzia Mastrorilli"",""Pete W Christopherson"",""Kellye Joiner""}"
361682,Oztcome of patients with severe PH due to lung disease with     and without targeted therapy,English,,,,32.0,,1/14/01,202-208,
732256,,,,1175-3277,0042-9686,85.0,8.0,7.0,615-622 8p,"{wRomero M"",""Mercer R"",""Ramos S"",""Karolinski A""}"
636937,,Health Technology Assessment Database,Plos Neglected Tropical Diseases,,1935-2735,6.0,,1/12/01,e1919,"{""Victor Kande"",""Epco Hasker"",""Veerle Lejon"",""Jean-Jacques Muyembe"",""Patrick Mitashi"",""Marleen Boelaert"",""Pascal Lutumba""}"
743394,,eng,Nouropharmacology,Neuropharmacology,Nbcotine & tobacco research : official journal of the Society for Research on Nicotine and Tobacco,0.0,,,81-90,"{eAntoine Hone-Blanchet"",""Shirley Fecteau""}"
592201,,JAMA otolaryngology-- head & neck surgery,,,,,12.0,5.0,131-4,"{lE. M. Quigley"",""J. K. DiBaise""}"
914007,Bvund for success: a systematic review of constraint-induced movement therapy in children with cerebral palsy supports improved arm and hand use (Structured abstract),,,Pdys Ther,,1/14/04,,1/9/01,,"{""H. H. Huang"",""J. Hale"",""L. Fetters"",""A. McBride""}"
208824,,,Physica D: Nonlinear Phenomena,,,,,,,"{""V.E. Zakharov"",""S. Dyachenko"",""A.C. Newell"",""A. Pushkarev""}"
759501,"[Progress in joint international research of demographic and geographic distribution of insignificant, middle and high-grade tuberculin skin sensitivity].",,,1432-1262,0044-2631,133.0,0.0,1.0,99-106,"{""M A Bleiker""}"
506162,Evficacy of Class 1 elastic compression stockings in the early stages of chronic venous disease. A comparative study.,eng,,1053881X (ISSN),0392-9590,,,1/3/12,383-92,
372697,,Annals of Internal Medicine,Blood Reviews,Blood Rev.,J Headache Pain,,69.0,1/14/09,,"{""R.A. Mesa"",""N.C.P. Cross"",""J.O. Mascarenhas""}"
609245,Rzinventing the wheel? Or the emperor's new clothes.,,J Altern Complement Med,,Stroke,,,,613-5,"{""George Vithoulkas"",""Menachem Oberbaum"",""Shepherd Singer"",""Robbert van Haselen""}"
584706,,,,,0098-7484,0.0,,,477-83,"{""G. S. McDonald"",""J. W. Bachman"",""P. C. O'Brien""}"
822897,"The Chinese medicine construct ""stagnation"" in mind-body connection mediates the effects of mindfulness training on depression and anxiety",,Complementary Therapies in Medicine,,Nursing standard (Royal College of Nursing (Great Britain) : 1987),21.0,32.0,,348-357,
145770,,eng,,,,77.0,0.0,,617-22,"{""Gilles Montalescot"",""Gordon FitzGerald"",""Kurt G Barringhaus"",""[Collective Name] GRACE Investigators"",""Frans Van de Werf"",""Joel M Gore"",""David D McManus"",""Jos L_pez-Send_n"",""Philippe Gabriel Steg"",""Kay Lee Park""}"
24026,,,,Nature,,6/1/97,7486.0,6/14/02,Jun-93,"{oMarcus R Munaf_"",""Mike W Peacey"",""In-Uck Park""}"
44484,"Exercise-induced flow limitation, dynamic hyperinflation and exercise capacity in patients with bronchial asthma.",eng,,0935-8943,0903-1936,24.0,,21.0,,
379988,Tpe combined role of serotonin and interleukin-6 as biomarker for autism,,,,,,0.0,1/22/15,,
333862,General public's and physicians' perception of health risk associated with radon exposure in the state of Azad Jammu and Kashmir,Journal of the National Cancer Institute,"Ptblic health nursing (Boston, Mass.)",,0737-1209,25.0,,1/8/01,327-35,
779555,Cost-effectiveness of statins for primary prevention in patients newly diagnosed with type 2 diabetes in the Netherlands,English,,,,9.0,2.0,,223-230,"{vS. T. Visser"",""M. J. Postma"",""P. Denig"",""F. M. De Vries"",""E. Hak""}"
323860,Wpmen's sexuality in the South African constitutional court,English,eng,,Biomed Rep,14.0,3.0,34.0,391-406,"{""E. Bonthuys""}"
646572,,ger,,,,135.0,31.0,,1531-7,"{eR Schwarz"",""J Ernst"",""M Zenger"",""E Br_hler"",""R Schmidt""}"
128182,"Arrandomized, double-blind, placebo controlled triphosphate in study of oral adenosine subacute low back pain",eng,eng,,Pediatrics,,,30.0,"1114-7 ST  - A randomized, double-blind, placebo controlled triphosphate in study of oral adenosine subacute low back pain-","{""M. Rossignol"",""F. A. Allaert"",""B. Bannwarth"",""J. P. C1  - Frn RCT-s_kningen CN  - Pubmed DA  - Jun DP  - NLM ET  - 2005/06/09 Valat"",""S. Rozenberg"",""B. Avouac""}"
252998,Efficacy and safety of NMDA receptor antagonists augmentation therapy for schizophrenia: An updated meta-analysis of randomized placebo-controlled trials,Social science & medicine (1982),,,,,,,,"{""Yuki Matsuda"",""Taro Kishi"",""Nakao Iwata""}"
231933,"Tkste, olfactory and food texture reward processing in the brain and obesity",,,22-Mar,,6/29/98,,,550-561,"{bE. T. Rolls""}"
683304,Prefrontal hypoactivation and recovery in insomnia.,eng,,Sleep,,,9.0,1/8/09,1271-6,
854628,Determinants of drug response in a cisplatin-resistant human lung cancer cell line.,eng,English,0300-8843,0910-5050,81.0,23.0,5/1/90,527-35,
117678,,,,J. Dent. Res.,0022-0345,,,1/1/12,Sep-55,"{uL J Hahn"",""C J Chiu"",""M L Chang"",""L L Hsieh"",""Y S Kuo"",""H M Chen"",""C P Chiang"",""C J Chen""}"
795170,,,,Ther Adv Respir Dis,,1/1/96,,,,
783722,,English,Cancer Epidemiology Biomarkers and Prevention,,J.Clin.Diagn.Res.,24.0,20.0,1/15/01,,"{qB. J. Caan"",""E. M. John"",""T. H. M. Keegan"",""A. H. Wu"",""L. Bernstein"",""S. Shariff-Marco"",""R. Sposto"",""C. C. Tseng"",""J. Sullivan-Halley"",""Y. Lu"",""C. Vigen"",""M. L. Kwan"",""S. L. Gomez"",""A. W. Kurian"",""I. Cheng"",""V. S. Lee""}"
376103,,Addictive Behaviors,,09593985 (ISSN),,1/15/01,8.0,,591-5,"{""Y. Akematsu"",""M. Tsuji"",""K. Minetaki""}"
505530,Fiscal impact of a potential legislative ban on second trimester elective terminations for prenatally diagnosed abnormalities (Structured abstract),,,,,,5.0,1/1/00,359-362,"{lE. L. Krivchenia"",""M. I. Evans"",""M. A. Ayoub"",""V. L. Miller"",""S. B. Ransom""}"
868618,Phase III randomized sequential open-label study to evaluate the efficacy and safety of sorafenib followed by pazopanib vs pazopanib followed by sorafenib in the treatment of advanced / metastatic renal cell carcinoma-design of the SWITCH-2 Study (NCT01613846),Ifdian Journal of Pathology and Microbiology,,Onkologie,0378-584X,,91.0,0.0,,"{rJ. Gschwend"",""S. Schirrmacher-Memmel"",""A. Beeker"",""M. O. Grimm"",""B. Brehmer"",""M. Zaiss"",""U. Von Verschuer"",""S. Pahernik"",""M. Bos"",""M. De Santis"",""M. Retz"",""S. Krause""}"
503451,Epidemiology of sporting injuries among elite soccer players: A longitudinal study,,,Rheumatology,J. Cardiovasc. Electrophysiol.,,0.0,1/12/01,,"{jM Gimpel"",""S Gadola"",""P Cooper"",""K Jameson"",""G Deakin"",""M Godtschailk"",""M Stokes"",""C Cooper""}"
113363,,,,1464-0325,,,,,,"{qA. L. Steege"",""T. Alterman"",""M. R. Petersen"",""J. Li""}"
944558,Mptor cortex stimulation in patients with post-stroke pain: conscious somatosensory response and pain control,Journal of the American Medical Informatics Association : JAMIA,Neurol Res,1528-395X,,25.0,,1/3/01,,"{""H. Oshima"",""K. Kobayashi"",""T. Yamamoto"",""M. Kasai"",""C. Fukaya"",""Y. Katayama""}"
875250,Antimicrobial resistance of H. pylori isolates in alaska native persons from 2000-2008: Results from the alaska sentinel surveillance project,International Journal of Qualitative Studies in Education (QSE),Helicobacter,,,,15.0,1/9/01,328,"{""M. G. Bruce"",""J. Morris"",""B. McMahon"",""A. Tveit"",""D. Hurlburt"",""D. Bruden""}"
786108,Results of the phase II NCRI CLL206 trial of alemtuzumab in combination with high-dose methylprednisolone for high-risk (17P-) CLL,,eng,,0390-6078,3.0,0.0,1/9/01,,
233544,Timely access to specialist medical oncology services closer to home for rural patients: experience from the Townsville Teleoncology Model.,eng,Tke Australian journal of rural health,Aust J Rural Health,Int J Med Inform,6/17/02,,1/14/08,156-9,"{""Sabe Sabesan"",""Peter Aiken"",""Lynden J Roberts"",""Sarah Larkins"",""Abhishek Joshi""}"
163093,Bnoavailability and tolerability of intranasal diazepam in healthy adult volunteers,English,,,,0.0,0.0,1/9/01,120-6 ST  - Bioavailability and tolerability of intranasal diazepam in healthy adult volunteers-,
31763,Protein kinase CK-1 inhibitors as new potential drugs for amyotrophic lateral sclerosis.,,,,1520-4804,4.0,6.0,53.0,2755-72,
949775,The Prevalence and Age-Related Characteristics of Pain in a Sample of Women Veterans Receiving Primary Care,Current Opinion in Infectious Diseases,Jjurnal of Women's Health (15409996),1439-6327,1540-9996,15.0,,1/6/01,,"{iAlicia Heapy"",""Sally G. Haskell"",""M. Carrington Reid"",""Robert D. Kerns"",""Rebecca K. Papas""}"
847600,,,,,1525-1446,2.0,-1.0,,,"{wAshley McDonald"",""Shannon N Zenk"",""Colleen Corte"",""Kelly K Jones""}"
638338,"Lotter by Raposeiras-Roubin et al regarding article, ""mortality associated with atrial fibrillation in patients with myocardial infarction: a systematic review and meta-analysis"".",eng,,Cdrculation,,124.0,40.0,,e483; author's reply e484,"{""Sergio Raposeiras-Roub_n"",""Jos Maria Garc_a-Acua"",""Jos Ram_n Gonzlez-Juanatey""}"
14077,Preferential expression of T-cell receptor V beta-chains in atopic eczema.,eng,,Acta Derm. Venereol.,,2.0,3.0,5/1/96,,"{""C L_liger"",""K Neuber"",""J Ring"",""I K_hler""}"
453607,Evidence-based evaluation of therapeutic measures for amyotrophic lateral sclerosis. [Chinese],,,,,1/9/01,22.0,,,{NULL}
690793,Eehanced meta-analysis of acetylcholine binding protein structures reveals conformational signatures of agonism in nicotinic receptors.,eng,Protein science : a publication of the Protein Society,Protein Sci.,Neurobiol. Aging,,3.0,1/12/03,,
799604,Factors associated with orthodontic patient compliance with intraoral elastic and headgear wear.,eng,,Am J Orthod Dentofacial Orthop,,97.0,20.0,,336-48,"{""E A BeGole"",""H S Upshaw"",""R J Egolf""}"
718091,"Al23-year-old Hispanic migrant fieldworker who presents with a painful rash on his limbs, trunk, and face. Guttate psoriasis.",eng,,,,5.0,,0.0,,"{""Richard Andrews"",""Erica B Lundsten"",""A Maureen Bundick Morgan""}"
935189,,,,,,17.0,,4/1/89,83-88,
711472,Irpact of diet restriction and/or resistance training on physical capacity in obese older women...7th World Congress on Aging and Physical Activity,,,,1063-8652,,0.0,,S67-8 1p,
660574,Mfta-analysis of the influence of I148M variant of patatin-like phospholipase domain containing 3 gene (PNPLA3) on the susceptibility and histological severity of nonalcoholic fatty liver disease.,,eng,Hepatology,,2/15/13,2014.0,,1883-94,"{""Silvia Sookoian"",""Carlos J Pirola""}"
873322,,eng,,,1076-6294 (Print)     1076-6294,16.0,68.0,,55-60,"{""C. Handgraaf"",""W. J. Melchers"",""T. Klaassen"",""P. D. Sturm"",""E. T. Bochum"",""S. V. van Mook-Vermulst""}"
774830,,,eng,14402440,0039-2499,,132.0,1/15/01,2335-2340,"{""Diederik van de Beek"",""Anthony G Rudd"",""Lalit Kalra"",""Joan Montaner"",""Javier Garau"",""Pippa J Tyrrell"",""Stephen J Hopkins"",""Craig J Smith"",""Mark Woodhead"",""Angel Chamorro"",""Mario Di Napoli"",""Andreas Meisel"",""Peter Langhorne"",""Andy Vail"",""Amit K Kishore"",""Christine Roffe""}"
768192,,eng,J Grad Med Educ,,,,,15.0,19-24,
950926,FpCTORS ASSOCIATED WITH SELF-WORTH IN YOUNG PEOPLE WITH PHYSICAL DISABILITIES,,Hxalth & Social Work,,,29.0,27.0,,,"{""Beverley J. Antle""}"
204215,Dffferent renal toxicity profiles in the association of cyclosporine and tacrolimus with sirolimus in rats.,,"Nephrology, dialysis, transplantation : official publication of the European Dialysis and Transplant Association - European Renal Association",Nephrol. Dial. Transplant.,1460-2385,,,,11-Sep,
129552,A meta-analysis of alcohol drinking and oral and pharyngeal cancers. Part 2: results by subsites.,,Oral oncology,,1879-0593,,,1/10/10,720-6,"{tPaolo Boffetta"",""Giovanni Corrao"",""Irene Tramacere"",""Vincenzo Bagnardi"",""Eva Negri"",""Lorenza Scotti"",""Werner Garavello"",""Matteo Rota"",""Carlo La Vecchia"",""Federica Turati"",""Farhad Islami""}"
526825,Gmnetic overlap between diagnostic subtypes of ischemic stroke.,Eeropean Journal of Cancer Care,Sxroke; a journal of cerebral circulation,,1524-4628,,3.0,1/15/03,615-9,
56464,Serum S100B represents a new biomarker for mood disorders.,,,,,14.0,25.0,26.0,,
20641,,Journal of receptor and signal transduction research,,,1872-6844,108.0,,,945-52,"{""Alfredo D'Aniello"",""Addolorata Mascia"",""Vincenzo Esposito"",""Pier Paolo Quarato"",""Marco De Risi"",""Angelo Picardi"",""Giancarlo Di Gennaro"",""Liliana G Grammaldo"",""Sara Casciato"",""Giulio N Meldolesi""}"
706764,Rsmote area indigenous psychiatry - Reflections on nine years as a visiting psychiatrist,,,,,45.0,145.0,1/11/01,A31,
388872,,Lvncet,,J. Heart Valve Dis.,0966-8519,20.0,,1/11/05,341-7,
