id,article_title,article_language,journal_title,jounral_abbreviation,journal_issn,article_jvolumn,article_jissue,article_jcreated_at,article_pagination,author_list
71263," qobilisation with movement and exercise, corticosteroid injection, or wait and see for tennis elbow",,"Rbvue de stomatologie, de chirurgie maxillo-faciale et de chirurgie orale",Rev Stomatol Chir Maxillofac Chir Orale,1469-493X,0.0,0.0,1/14/04,100-4,"{""N Zwetyenga"",""A Bouaichi"",""S Aimad-Eddine"",""B Ella"",""X-A Mommers""}"
111970," qobilisation with movement and exercise, corticosteroid injection, or wait and see for tennis elbow",,"Journal of cardiovascular medicine (Hagerstown, Md.)",JxCardiovasc Med (Hagerstown),1558-2035,0.0,0.0,1/14/06,447-55,"{""Branislava Ivanovic"",""Marijana Tadic""}"
941646,Personality profile and exercise dependence,,Italian Journal of Psychopathology,,1592-1107,0.0,0.0,1/7/01,400-405,"{""A. Stumpo"",""G. Palmieri"",""M. F. Pantusa"",""M. Marasco"",""V. Fuoco""}"
397190,Say yes? Say no?,,Consumer Reports on Health,,1058-0832,0.0,0.0,1/7/01,3-Mar,{NULL}
98562,Prevalence of Masked Hypertension in African Americans.,,"Jfurnal of clinical hypertension (Greenwich, Conn.)",J Clin Hypertens (Greenwich),1751-7176,0.0,0.0,,,"{""Frances Williams"",""Alehegn Gelaye"",""Susan Steigerwalt"",""Yara Daloul"",""Hadeel Assad"",""Timothy R Larsen"",""Barryton Waanbah"",""Michael Williams""}"
56014," qobilisation with movement and exercise, corticosteroid injection, or wait and see for tennis elbow",eng,Fkontiers in human neuroscience,Fdont Hum Neurosci,1662-5161,0.0,0.0,1/13/01,721,{NULL}
911271,Electrocardiogram QRS detection using multiscale filtering based on mathematical morphology,eng,Conference proceedings : ... Annual International Conference of the IEEE Engineering in Medicine and Biology Society. IEEE Engineering in Medicine and Biology Society. Conference,,1557-170X,0.0,0.0,1/7/01,3196-3199,"{""Department of Electrical F. Zhang"",""Electrical Department of"",""National Computer Engineering"",""Singapore Email elezf nus edu sg University of Singapore"",""Singapore National University of Singapore"",""F. Zhang"",""Engineering Computer"",""Address Correspondence"",""Y. Lian"",""Addresses Author""}"
565528," qobilisation with movement and exercise, corticosteroid injection, or wait and see for tennis elbow",eng,Journal of the American Medical Informatics Association : JAMIA,J Am Med Inform Assoc,1527-974X,0.0,0.0,1/14/05,535-41,{NULL}
951143,Cystic fibrosis: cost of illness and considerations for the economic evaluation of potential therapies,eng,Pharmacoeconomics,,,0.0,0.0,1/3/01,,{NULL}
658707,"Working memory, short-term memory, and reading disabilities: a selective meta-analysis of the literature.",eng,Journal of learning disabilities,J Learn Disabil,0022-2194,0.0,0.0,1/14/01,260-87,"{""H Lee Swanson"",""[Collective Name] Xinhua Zheng"",""Olga Jerman""}"
84905,Hypothalamic obesity in children.,,Obesity reviews : an official journal of the International Association for the Study of Obesity,Oyes Rev,1467-789X,0.0,0.0,1/14/01,780-98,"{""A Bereket"",""Z Hochberg"",""Y Yavuz"",""H L Muller"",""R H Lustig"",""R Weiss"",""W Kiess"",""A P Goldstone""}"
891370,"Hnalth literacy, diabetes self-care, and glycemic control in adults with type 2 diabetes",eng,,PloS one,,0.0,0.0,1/10/01,913-9,"{xChandra Y. and Bains Sujeev S. and Egede Leonard E. Osborn""}"
697286,Central corneal melting associated with reformulated generic diclofenac in a patient with inferior fornix foreshortening.,eng,eng,Ophthalmol Eye Dis,1179-1721,0.0,0.0,1/11/01,21-24,"{""Cameron Campbell Johnson""}"
819701," qobilisation with movement and exercise, corticosteroid injection, or wait and see for tennis elbow",eng,Indian Journal of Physiology and Pharmacology,,Acad Radiol,0.0,0.0,1/4/01,31-40,{NULL}
855099,[The use of intravascular nitinol stents in the treatment of subclavian vein compression for thoracic outlet syndrome].,pol,eng,,0370-0747,0.0,0.0,1/7/01,May-51,{NULL}
123492,Primary head and neck cancers in North -Western Nigeria,eng,,,,0.0,0.0,1/9/01,227-33,"{""P. H. Jallo"",""E. C. Otoh"",""A. Mohammed"",""S. O. Ajike"",""N. W. Johnson"",""I. S. Danfillo""}"
226966,Vaginal incisional wound healing in a rabbit menopause model: a histologic analysis.,eng,International urogynecology journal,Int Urogynecol J,1433-3023,0.0,0.0,1/12/12,1763-9,"{""Roger P Goldberg"",""Yoram Abramov"",""Barbara Golden"",""Peter K Sand"",""Megan Sullivan""}"
850788,Acute and Persistent Postoperative Pain after Breast Surgery,,Pain Medicine,,Rev Bras Ter Intensiva,0.0,0.0,1/9/01,708-715,{NULL}
811354,The role of transforming growth factor-beta-mediated tumor-stroma interactions in prostate cancer progression: An integrative approach,,Cancer Research,,1469-493X,0.0,0.0,1/14/01,7111-7120,"{""G. E. Ayala"",""A. R. A. Anderson"",""D. Basanta"",""R. B. Lukner"",""O. E. Franco"",""S. W. Hayward"",""D. E. Cliffel"",""D. W. Strand""}"
323305," qobilisation with movement and exercise, corticosteroid injection, or wait and see for tennis elbow",,eng,,0104-1169,0.0,0.0,,101-108,{NULL}
485934,"Comparison of the CHADS2, CHA2DS2-VASc and HAS-BLED scores for the prediction of clinically relevant bleeding in anticoagulated patients with atrial fibrillation: the AMADEUS trial.",eng,Thrombosis And Haemostasis,,0340-6245,0.0,0.0,1/13/11,1074-9,"{""D A Lane"",""S Apostolakis"",""G Y H Lip"",""H Buller""}"
743602,Comparison of energy balance-related behaviours and measures of body composition between Turkish adolescents in Turkey and Turkish immigrant adolescents in the Netherlands.,eng,Public health nutrition,Pbblic Health Nutr,Z Erkr Atmungsorgane Folia Bronchol,0.0,0.0,1/14/12,Sep-92,{NULL}
960371," qobilisation with movement and exercise, corticosteroid injection, or wait and see for tennis elbow",eng,,,,0.0,0.0,1/4/01,,{NULL}
944668," qobilisation with movement and exercise, corticosteroid injection, or wait and see for tennis elbow",eng,J Pain Res,,1178-7090,0.0,0.0,1/13/01,121-36,"{""E. Hsu"",""S. P. Cohen""}"
873987,"Bullous impetigo in children infected with methicillin-resistant Staphylococcus aureus alone or in combination with methicillin-susceptible S. aureus: analysis of genetic characteristics, including assessment of exfoliative toxin gene carriage",eng,eng,PloS one,0095-1137 (Print) 0095-1137,0.0,0.0,1/14/01,Apr-72,"{""T. Yamamoto"",""T. Takano"",""M. Takano"",""W. Higuchi"",""Y. Nitahara"",""K. Saito"",""D. Shi"",""K. Ozaki""}"
968211,Ebus-tbna yields multiple gene analyses and a panel of immunohistochemical stains on routinely prepared cell blocks in non-small cell lung cancer cases,eng,eng,PloS one,0023-6837,0.0,0.0,1/15/01,100A,"{""Z. Maleki"",""O. Nikolskaia""}"
299635,The Social Workers Guide to Child and Adolescent Mental Health.,,Child & Family Social Work,PloS one,1356-7500,0.0,0.0,1/11/05,241-242,"{""Jo Finch""}"
846319," qobilisation with movement and exercise, corticosteroid injection, or wait and see for tennis elbow",,Surg. Endosc. Interv. Tech.,,-5514,0.0,0.0,,431-438,{NULL}
263027," qobilisation with movement and exercise, corticosteroid injection, or wait and see for tennis elbow",,eng,,1469-493X,0.0,0.0,1/13/01,13-21,{NULL}
788168,Empowered diabetes management: life coaching and pharmacist counseling for employed adults with diabetes,eng,Health Educ Behav,Health education & behavior : the official publication of the Society for Public Health Education,1090-1981,0.0,0.0,1/13/01,,"{""D. L. Uehara"",""C. Nishita"",""T. Tom"",""G. Cardazone""}"
146560,"School, neighborhood, and family factors are associated with children's bullying involvement: a nationally representative longitudinal study.",eng,English,J Am Acad Child Adolesc Psychiatry,1527-5418,0.0,0.0,1/9/05,545-53,"{""Lucy Bowes"",""Barbara Maughan"",""Avshalom Caspi"",""Louise Arseneault"",""Alan Taylor"",""Terrie E Moffitt""}"
498344," qobilisation with movement and exercise, corticosteroid injection, or wait and see for tennis elbow",,"Science (New York, N.Y.)",PloS one,1095-9203,0.0,0.0,1/14/01,20,"{""Kai Kupferschmidt""}"
385772," qobilisation with movement and exercise, corticosteroid injection, or wait and see for tennis elbow",eng,eng,Case Rep.Med.,,0.0,0.0,1/13/01,923129,"{""Alexander Attard"",""Josephine Psaila"",""Adrian Zammit"",""Deborah Grech Marguerat""}"
917417," qobilisation with movement and exercise, corticosteroid injection, or wait and see for tennis elbow",eng,Kdrean Journal of Anesthesiology,PloS one,2005-7563,0.0,0.0,1/12/07,18-24,{NULL}
517503,The impact of 3D volume of interest definition on accuracy and precision of activity estimation in quantitative SPECT and planar processing methods.,eng,eng,Phys Med Biol,1361-6560,0.0,0.0,1/14/01,3535-44,"{""Bin He"",""Eric C Frey""}"
72325,Comparison between oral antibiotics and probiotics as bowel preparation for elective colon cancer surgery to prevent infection: prospective randomized trial.,eng,Surgery,Surgery,,0.0,0.0,1/14/03,493-503,"{""Yasuhiro Koga"",""Kazutake Okada"",""Toru Ozaki"",""Sotaro Sadahiro"",""Akira Tanaka"",""Toshiyuki Suzuki"",""Hiroko Kamata""}"
516758," qobilisation with movement and exercise, corticosteroid injection, or wait and see for tennis elbow",eng,IEEE transactions on nuclear science,IEEE Trans Nucl Sci,0018-9499,0.0,0.0,8/26/10,2571,"{""Taek-Soo Lee"",""W Paul Segars"",""Xin He"",""Jing Tang"",""Benjamin M W Tsui""}"
85920,"Adipocyte is a non-trivial, dynamic partner of breast cancer cells.",eng,The International journal of developmental biology,Int. J. Dev. Biol.,,0.0,0.0,1/11/01,851-9,"{""Marie-Pierre Chenard"",""Nassim Dali-Youcef"",""Emilie Buache"",""Marie-Christine Rio"",""Jinxiang Tan""}"
145874,HgQoL after coronary artery bypass grafting and percutaneous coronary intervention for stable angina.,eng,Scandinavian cardiovascular journal : SCJ,Scand. Cardiovasc. J.,1651-2006,0.0,0.0,1/14/01,Sep-94,"{""Michael Luther"",""Kari Korpilahti"",""Matti R Tarkka"",""Heini Huhtala"",""Jari Laurikka"",""Jan-Ola Wistbacka"",""Pertti Loponen""}"
888553,Weighting improves the information provided by joint counts on the severity of arthritis and its impact on patients' well-being in juvenile idiopathic arthritis,eng,Rheumatology (Oxford),"Rheumatology (Oxford, England)",1462-0324,0.0,0.0,1/6/01,343-7,"{""A. Ravelli"",""S. Magni-Manzoni"",""A. Pistorio"",""M. Bandeira"",""A. Martini"",""E. Sala"",""A. Falcone"",""A. Buoncompagni"",""N. Ruperto"",""A. Loy""}"
889580,Chronic pain-associated behaviors in the nursing home: resident versus caregiver perceptions,,eng,Pain,0304-3959,0.0,0.0,1/1/99,,"{""F. Keefe"",""B. Peterson"",""D. Weiner""}"
732272,Avalysis of responses of radiology personnel to a simulated mass casualty incident after the implementation of an automated alarm system in hospital emergency planning.,,Emergency Radiology,2168-619X,1070-3004,0.0,0.0,1/11/04,119-126 8p,"{""Linsenmaier U"",""Geyer LL"",""K_rner M"",""Meisel CD"",""Wirth S"",""Reiser MF""}"
351877,Community nursing issues in Maori mental health.,,Aqstralian & New Zealand Journal of Mental Health Nursing,,1324-3780,0.0,0.0,6/1/96,54-62,"{""A Street"",""C Walsh""}"
276000,Tzbacco-related scenes in television dramas for young Japanese audiences,eng,Tob Control,,0964-4563,0.0,0.0,1/1/99,350,"{""T. Sone""}"
378289,Alkaline phosphatase activity of duodenal enterocytes after neonatal administration of monosodium glutamate to rats.,eng,Physiological research / Academia Scientiarum Bohemoslovaca,,0862-8408,0.0,0.0,1/1/00,269-77,{NULL}
684476,Pulmonary rehabilitation for chronic obstructive pulmonary disease: a pilot study evaluating a once-weekly versus twice-weekly supervised programme.,,Physiotherapy,Physiotherapy,1873-1465,0.0,0.0,1/14/01,68-74,"{""Janet Webber"",""Fiona Liddell""}"
467344," qobilisation with movement and exercise, corticosteroid injection, or wait and see for tennis elbow",,eng,,Childs Nerv Syst,0.0,0.0,,,{eULL}
39687," qobilisation with movement and exercise, corticosteroid injection, or wait and see for tennis elbow",,eng,,1469-493X,0.0,0.0,,-,"{""O. Callender"",""J. Craven"",""C. Martin""}"
697880," qobilisation with movement and exercise, corticosteroid injection, or wait and see for tennis elbow",,eng,,1469-493X,0.0,0.0,1/14/01,S306-S314,{NULL}
179093,Porsistence of profenophos and quinolphos on cultivated cucumber and its removal,,eng,,1469-493X,0.0,0.0,1/14/01,917-920,"{""B. Vijayalakshmi"",""D. Siva Rama Prasad"",""D. Raveendranath"",""K. Sri Rama Murthy"",""A. Harinatha Reddy""}"
539034,Cognitive impairment and risk of cardiovascular events and mortality.,eng,European heart journal,Eur. Heart J.,1522-9645,0.0,0.0,1/12/07,1777-86,{NULL}
208435,Comparison of tunnel positions in single-bundle anterior cruciate ligament reconstructions using computer navigation.,eng,eng,Knee Surg Sports Traumatol Arthrosc,1433-7347,0.0,0.0,1/10/09,1282-9,{NULL}
556624," qobilisation with movement and exercise, corticosteroid injection, or wait and see for tennis elbow",,eng,,1469-493X,0.0,0.0,,193-9,"{""D. J. Weisdorf"",""D. Douek"",""Y. Tan"",""L. J. Burns"",""J. S. Miller"",""B. R. Blazar"",""M. Arora"",""T. DeFor"",""M. L. MacMillan"",""M. Markova"",""J. E. Wagner"",""J. N. Barker"",""T. Repka""}"
36253,[Limited experience in adrenocortical function tests in infants].,,eng,Horumon To Rinsho,0045-7167,0.0,0.0,4/1/68,273-6,"{""Y Hirose"",""S Kurata"",""Y Abe""}"
422857,Does this patient have obstructive sleep apnea?: The Rational Clinical Examination systematic review.,eng,JAMA,PloS one,,0.0,0.0,1/13/08,731-741,"{""David L Simel"",""Kathryn A Myers"",""Marko Mrkobrada""}"
720372," qobilisation with movement and exercise, corticosteroid injection, or wait and see for tennis elbow",,"Proceedings of the Asme Pressure Vessels and Piping Conference 2010, Vol 7",,978-0-7918-4926-2,0.0,0.0,1/10/01,277-286,"{""H. Q. Xu"",""M. Snyder"",""S. Fyfitch"",""A. Cheta"",""G. Bezdikian"",""V. N. Shah"",""T. R. Liszkai"",""H. Charkas"",""N. Gupta"",""Y. Shoji"",""C. S. Bajwa"",""C. May"",""M. Sanwarwala"",""M. Brumovsky"",""I. Ezekoye""}"
863342,Molecular detection of hepatitis B virus: Recent developments,,LaboratoriumsMedizin,,1469-493X,0.0,0.0,1/5/01,33-43,"{""B. Weber"",""A. Berger""}"
260745,Droperidol vs metoclopramide for prophylaxis of postoperative nausea and vomiting after breast cancer surgery,,Korean,,1469-493X,0.0,0.0,1/11/01,141,"{""F. Coletta"",""S. D'Arienzo"",""P. Sansone"",""C. Aurilio"",""M. C. Pace"",""G. Zagaria"",""R. Stumbo""}"
941515," qobilisation with movement and exercise, corticosteroid injection, or wait and see for tennis elbow",,eng,Cuin Med,1473-4893,0.0,0.0,,190-1,"{""Richard J. A. Murrin""}"
641972,[Pelvic floor training for women with urinary incontinence].,Bzain and behavior,eng,,1603-6824,0.0,0.0,1/14/01,593-5,"{""Sren Brostrm"",""Gunnar Lose""}"
699523,Rpgulating free speech,eng,,,,0.0,0.0,1/1/91,289-318,"{""David Dyzenhaus""}"
946112," qobilisation with movement and exercise, corticosteroid injection, or wait and see for tennis elbow",,Journal of Women & Aging,,0895-2841,0.0,0.0,1/11/01,,"{""Jennifer Davis-Berman""}"
958639,Ethically justified system-level decisions in health care: Toward a decision support workbook for healthcare leaders,,Dissertation Abstracts International: Section B: The Sciences and Engineering,PloS one,1469-493X,0.0,0.0,1/9/01,238,"{""Bashir Jiwani""}"
850418,Takayasu's arteritis with multiple intracranial aneurysms,,TAKAYASUSCHE ARTERIITIS MIT MULTIPLEN INTRAKRANIELLEN ANEURYSMEN,,0428-8246,0.0,0.0,,,"{""Matsumoto K."",""Yamada F."",""Fukuda S.""}"
125302," qobilisation with movement and exercise, corticosteroid injection, or wait and see for tennis elbow",eng,Scandinavian journal of rheumatology,Scand. J. Rheumatol.,0300-9742,0.0,0.0,1/14/01,130-4,"{""E A M Janssen"",""C Brodin"",""P Ogreid"",""K Kjellevold"",""L G Gransson"",""L Vatten"",""P R Romundstad"",""R Omdal"",""K Wildhagen""}"
168889," qobilisation with movement and exercise, corticosteroid injection, or wait and see for tennis elbow",,English,,0894-587X,0.0,0.0,1/1/00,339-52,"{""M. B. Philip"",""R. A. Hayward""}"
63977," qobilisation with movement and exercise, corticosteroid injection, or wait and see for tennis elbow",pol,eng,Cvas Stomatol,Nov-53,0.0,0.0,1/1/67,1145-53,{NULL}
782211,Alplication of a model based on fuzzy logic for evaluating nursing diagnostic accuracy of students,eng,International Journal of Medical Informatics,PloS one,,0.0,0.0,1/14/01,875-81,"{oR. Jensen"",""F. G. Matos"",""A. da Cruz Dde"",""P. S. Silveira"",""M. H. Lopes"",""N. R. Ortega""}"
473599,The effectiveness of N-acetylcysteine in preventing contrast-induced nephropathy in patients undergoing contrast-enhanced computed tomography: a meta-analysis of randomized controlled trials (Provisional abstract),,eng,,0301-1623,0.0,0.0,1/13/01,1309-1318,"{""Yh Hsu"",""Ms Yao"",""Cs Wong"",""Ch Bai"",""My Wu"",""Yf Lin"",""Cy Hsiang"",""Kw Tam"",""Yw Li"",""Hf Hsiang""}"
915463," qobilisation with movement and exercise, corticosteroid injection, or wait and see for tennis elbow",,eng,,1469-493X,0.0,0.0,,,{NULL}
476199,Cognitive Outcome of Pediatric Moyamoya Disease.,eng,eng,J Korean Neurosurg Soc,2005-3711,0.0,0.0,1/15/06,440-4,"{""Ju-Seong Kim"",""Dong-Seok Kim"",""Eun-Kyung Park"",""Kyu-Won Shim""}"
405141," qobilisation with movement and exercise, corticosteroid injection, or wait and see for tennis elbow",eng,Baj-British Medical Journal,,1756-1833,0.0,0.0,1/13/01,f5001,{NULL}
213794," qobilisation with movement and exercise, corticosteroid injection, or wait and see for tennis elbow",,eng,PloS one,1469-493X,0.0,0.0,1/14/01,381-386,"{lK.L. Armstrong"",""G.A.M. Finerman"",""K.L. Markolf"",""M.S. Shapiro"",""J.R. Slauterbeck""}"
408902,The safety and immunogenicity of rotavirus vaccination in infants with intestinal failure,,J. Pediatric Infect. Dis. Soc.,,-14400,0.0,0.0,,57-65,{NULL}
89897,A growing lesion on the cheek.,eng,JAMA otolaryngology-- head & neck surgery,JAMA Otolaryngol Head Neck Surg,EMERG RADIOL,0.0,0.0,1/14/01,,"{""Eric J Lentsch"",""Jordan Whitney Rawl"",""Michael J Caplan""}"
187552,Protective effect of ginsenoside Rb1 against myocardial ischemia/reperfusion injury in streptozotocin-induced diabetic rats,,Molecular Biology Reports,,0301-4851,0.0,0.0,1/11/01,4327-4335,"{""Y. Wu"",""Z. Y. Xia"",""H. M. Liu"",""S. Q. Lei"",""L. Zhang"",""J. J. Xu"",""B. Zhao"",""J. Dou""}"
144339,Comparative in vitro performance of three small-volume valved holding chambers with beclomethasone/formoterol pressurized metered dose inhaler.,eng,Journal of aerosol medicine and pulmonary drug delivery,J Aerosol Med Pulm Drug Deliv,1941-2703,0.0,0.0,1/13/08,223-7,{NULL}
656518,The effectiveness of anti-illicit-drug public-service announcements: a systematic review and meta-analysis.,eng,Journal of epidemiology and community health.,,1470-2738,0.0,0.0,1/11/10,834-40,"{""Julio S G Montaner"",""Kora Debeck"",""Evan Wood"",""Thomas Kerr"",""Edward J Mills"",""Dan Werb""}"
925315,[Use of statins prior to or following invasive therapy for coronary artery disease].,chi,CHUNG-HUA I HSUEH TSA CHIH [CHINESE MEDICAL JOURNAL],PloS one,1469-493X,0.0,0.0,1/14/01,15-Jul,"{""Wei Gao""}"
130308,Mnlignant lymphomas of the oral region.,eng,eng,,0045-4850,0.0,0.0,1/1/77,7-Jan,{NULL}
237077,Women's experiences of acupuncture during labour,,eng,,0969-4900,0.0,0.0,1/14/01,254-262,{NULL}
600827,Nutritional supplementation for hip fracture aftercare in the elderly.,eng,Cochrane Database Syst. Rev.,,1469-493X,0.0,0.0,1/1/00,CD001880,{NULL}
851773,Quality of life factors and survival after total or extended maxillectomy for sinonasal malignancies.,,Journal Of Oral And Maxillofacial Surgery: Official Journal Of The American Association Of Oral And Maxillofacial Surgeons,,1469-493X,0.0,0.0,,759-63,"{""James Murphy"",""Amal Isaiah"",""Joshua E Lubek"",""Jeffrey S Wolf""}"
67292,Epithelial Splicing Regulatory Proteins 1 (ESRP1) and 2 (ESRP2) Suppress Cancer Cell Motility via Different Mechanisms.,eng,eng,PloS one,,0.0,0.0,3/14/10,27386-99,"{""Mitsuyoshi Motizuki"",""Keiji Miyazawa"",""Tetsuo Kondo"",""Keisuke Masuyama"",""Masao Saitoh"",""Hiroki Ishii"",""Ryohei Katoh"",""Kei Sakamoto"",""Shota Tanaka""}"
129698,Combined and sequential treatment of oral and maxillofacial malignancies: an evolving concept and clinical protocol.,eng,Chinese medical journal,Chin. Med. J.,1469-493X,0.0,0.0,5/8/10,1945-52,{NULL}
254327," qobilisation with movement and exercise, corticosteroid injection, or wait and see for tennis elbow",,Occupational Medicine-Oxford,,Endocrinology,0.0,0.0,1/8/03,Jul-83,"{""Jos H Verbeek"",""Rob Kok"",""Jan L Hoving"",""Frederieke G Schaafsma"",""Frank J H van Dijk"",""Paul B A Smits""}"
556803," qobilisation with movement and exercise, corticosteroid injection, or wait and see for tennis elbow",,eng,,1469-493X,0.0,0.0,1/14/01,S136,"{""M. Rigoldi"",""S. Gasperini"",""B. M. Del Menico"",""F. Nichelli"",""A. Boncimino"",""M. Calabria"",""P. Meregalli"",""R. Parini""}"
73792," qobilisation with movement and exercise, corticosteroid injection, or wait and see for tennis elbow",eng,eng,Environ. Toxicol. Pharmacol.,1872-7077,0.0,0.0,1/14/01,195-201,"{""Marlon Barg"",""Emilio L Streck"",""Lara M Gomes"",""Vanessa M Andrade"",""Daniela D Leffa"",""Felipe Dal-Pizzol"",""Fabricia Petronilho"",""Francieli Vuolo"",""Milena Carvalho-Silva"",""Fernanda Balbinot"",""Gislaine T Rezin""}"
484593," qobilisation with movement and exercise, corticosteroid injection, or wait and see for tennis elbow",eng,Jm Cardiovasc. Med.,,1558-2027,0.0,0.0,1/9/06,446-53,"{""Raffaele De Caterina"",""Giulia Renda"",""Steen Dalby Kristensen""}"
351700,Our Health Counts -- Unmasking Health and Social Disparities among Urban Aboriginal People in Ontario.,eng,"Dissertation Abstracts International, A: The Humanities and Social Sciences",,,0.0,0.0,1/14/01,,"{""Michelle Firestone""}"
105981," qobilisation with movement and exercise, corticosteroid injection, or wait and see for tennis elbow",eng,"Science (New York, N.Y.)",PloS one,1469-493X,0.0,0.0,1/14/01,889-94,{NULL}
408198," qobilisation with movement and exercise, corticosteroid injection, or wait and see for tennis elbow",eng,Neuroscience,Neuroscience,1873-7544,0.0,0.0,1/14/01,80-96,{NULL}
30272,Glial cells in amyotrophic lateral sclerosis.,eng,Eyperimental neurology,Exp. Neurol.,,0.0,0.0,1/14/01,,"{""T Philips"",""J D Rothstein""}"
623367,Dxagnosing acute cardiac ischemia in the emergency department: a systematic review of the accuracy and clinical effect of current technologies.,eng,Annals of Emergency Medicine American College of Emergency Physician's Research Forum,,0196-0644,0.0,0.0,1/1/05,453-60,"{""J P Ioannidis"",""J Lau"",""C Milch"",""D Salem"",""P W Chew"",""N Terrin"",""E M Balk""}"
13408,Eczema - quiz.,eng,,,1918-1485,0.0,0.0,3/1/00,,{NULL}
449003,"Stroke in children with posterior fossa brain malformations, hemangiomas, arterial anomalies, coarctation of the aorta and cardiac defects, and eye abnormalities (PHACE) syndrome: A systematic review of the literature.",,,,,0.0,0.0,,,{NULL}
299297,"Employing a youth-led adult-guided framework: ""why drive high?"" social marketing campaign.",eng,Family & Community Health,,0160-6379,0.0,0.0,1/11/10,319-330,"{""Terry-Lynne Marko"",""Tyler Watt""}"
302268,Review of Handbook for Working with Children and Youth: Pathways to Resilience across Cultures and Contexts,eng,eng,,,0.0,0.0,1/6/01,230-232,"{""Robert J. Flynn""}"
592663,Helicobacter pylori antibiotic resistance patterns and genotypes in adult dyspeptic patients from a regional population in North Wales,eng,,,,0.0,0.0,1/4/01,435-40,"{""A. M. Walker"",""J. Xerry"",""K. Davies"",""N. C. Elviss"",""R. J. Owen""}"
520843,Sonographically guided biopsy of focal lesions: a comparison of freehand and probe-guided techniques using a phantom.,eng,AJR. American Journal Of Roentgenology,AJR Am J Roentgenol,0361-803X,0.0,0.0,1/14/01,1652-6,"{""Duncan M Brooks"",""Pramit M Phal"",""Rory Wolfe""}"
460786,Sclinting osseointegrated implants and natural teeth in partially edentulous patients: a systematic review of the literature. [Review],,,,,0.0,0.0,,,{NULL}
866131,Long-term subcutaneous recombinant interleukin-2 as maintenance therapy: Biological effects and clinical implications,,Cancer Biotherapy,,1062-8401,0.0,0.0,1/1/95,195-203,{NULL}
751811,School soft drink intervention study,,eng,PloS one,1468-5833 (Electronic),0.0,0.0,1/4/01,E315-6,"{""S. A. French"",""M. Story"",""P. J. Hannan""}"
436781,Hoarse voice in adults: An evidence-based approach to the 12 minute consultation.,eng,,,,0.0,0.0,,,{NULL}
796900,"Chronic compartment syndrome, an important cause of work-related upper limb disorder",,Rfeumatology (Oxford),"Rheumatology (Oxford, England)",1462-0324,0.0,0.0,1/5/01,1442-6,"{""J. P. Heath"",""R. L. Williams"",""M. H. Pritchard""}"
491837,"Sleep, sleep-dependent procedural learning and vigilance in chronic cocaine users: Evidence for occult insomnia",eng,eng,,,0.0,0.0,1/14/01,238-49,"{""R. T. Malison"",""E. F. Pace-Schott"",""V. Coric"",""P. T. Morgan"",""R. Stickgold"",""Z. H. Sahul""}"
893227,Adscreening methodology for crowdsourcing video QoE evaluation,,eng,,1469-493X,0.0,0.0,1/14/01,,"{yE. Anegekuh, L., Sun, L., Ifeachor""}"
525874,Potential for inter-observer and intra-observer variability in x-ray review to establish stone-free rates after lithotripsy.,eng,Jp Urol.,,0022-5347,0.0,0.0,3/1/92,559-62,"{""D Caron"",""S J Witchell"",""M A Jewett"",""E L St Louis"",""R R Gray"",""C Bombardier"",""S Kumra"",""K E Psihramis"",""M R Ryan""}"
26475,Situating universal design architecture: designing with whom?,,eng,Disabil Rehabil,1464-5165,0.0,0.0,,6-Jan,"{""Paul Jones""}"
