id,article_title,article_language,journal_title,jounral_abbreviation,journal_issn,article_jvolumn,article_jissue,article_jcreated_at,article_pagination,author_list
288711,Lcparoscopic reversal of Hartmann's rectosigmoidectomy,,Colorectal disease : the official journal of the Association of Coloproctology of Great Britain and Ireland,,Dis. Esophagus,0.0,0.0,1/8/01,81-83,"{""S. Slawik"",""A. R. Dixon""}"
184949," qobilisation with movement and exercise, corticosteroid injection, or wait and see for tennis elbow",,eng,,1469-493X,0.0,0.0,1/14/01,562-569,{NULL}
833251," qobilisation with movement and exercise, corticosteroid injection, or wait and see for tennis elbow",,Journal of Consulting and Clinical Psychology,,1469-493X,0.0,0.0,1/6/01,112-120,"{""E. Frank"",""L.D. Torres"",""D. Kupfer"",""K.L. Harkness"",""J. Guillaumot"",""J.E. Roberts"",""S.M. Monroe""}"
470174,Value of spiral CT in hemodynamically stable patients following blunt chest trauma.,,Computerized Medical Imaging and Graphics: The Official Journal of the Computerized Medical Imaging Society,Comput Med Imaging Graph,0895-6111,0.0,0.0,1/14/01,447-52,"{""R Tello"",""K Kandarpa"",""R F Munden"",""S Hooton"",""R Pugatch""}"
315926,Preventing injuries through interventions for problem drinking: a systematic review of randomized controlled trials,,eng,PloS one,1469-493X,0.0,0.0,1/1/99,609-21,"{""I. Roberts"",""E. Heitman"",""C. Diguiseppi"",""T. Dinh-Zarr""}"
901385,Nutrition and obstructed labor,,American Journal of Clinical Nutrition,,1469-493X,0.0,0.0,,,"{""O. A. Ladipo"",""J. C. Konje""}"
787529,"Rationale, design and methods of the HEALTHY study nutrition intervention component",eng,eng,International journal of obesity (2005),,0.0,0.0,1/9/01,S29-36,"{""S. McCormick"",""B. Gillis"",""A. Virus"",""M. A. Staten"",""C. Mobley"",""S. L. Volpe"",""J. Bridgman"",""L. El ghormli"",""D. D. Stadler"",""J. Hartstein""}"
431348,Atomoxetine treatment of children and adolescents with ADHD: Clinical questions and answers. (German),,,,,0.0,0.0,,,{NULL}
441393," qobilisation with movement and exercise, corticosteroid injection, or wait and see for tennis elbow",,,,Can Forces Dent Serv Q,0.0,0.0,,,{NULL}
481882," qobilisation with movement and exercise, corticosteroid injection, or wait and see for tennis elbow",eng,Erdocrinology,Endocrinology,1945-7170,0.0,0.0,1/13/09,3118-29,{NULL}
572425,Primary cutaneous large B-cell lymphoma of the legs: a distinct clinical pathologic entity treated with CD20 monoclonal antibody (rituximab).,eng,American Journal of Clinical Oncology-Cancer Clinical Trials,,,0.0,0.0,1/1/06,237-40,"{""D M Aboulafia""}"
581864," qobilisation with movement and exercise, corticosteroid injection, or wait and see for tennis elbow",,International Journal of Behavioral Consultation and Therapy,,1555-7855,0.0,0.0,1/14/01,432-438,"{""Marcie W. Handler"",""James K. Luiselli"",""Jennifer A. Mautone""}"
455406,Green tea in dermatology. [Review],,,PloS one,,0.0,0.0,,,{NULL}
696362,Teaching Calculus and Other Challenging Courses to Nontraditional and At-Risk Students at a Research University.,,eng,PloS one,1469-493X,0.0,0.0,1/6/01,291-297,"{""C. G. Mendez""}"
504206,Tropical infection after a case of total hip arthroplasty.,,The Journal of hospital infection,J. Hosp. Infect.,1532-2939,0.0,0.0,1/14/01,179-81,"{""E Senneville"",""H Melliez"",""V Lovi"",""C Joseph"",""M Douaud"",""M Pradier"",""T Boyer"",""A Meybeck"",""L Fortin-Lebraud""}"
800900,Chronic pelvic pain.,eng,Best practice & research. Clinical gastroenterology,Best Pract Res Clin Gastroenterol,,0.0,0.0,1/9/01,593-610,"{""Andrew Paul Baranowski""}"
235689,Oystetrical anal sphincter laceration and anal incontinence 5-10 years after childbirth,eng,eng,American journal of obstetrics and gynecology,0002-9378 (Print) 0002-9378,0.0,0.0,1/12/01,425.e1-6,"{nK. C. McDermott"",""J. L. Blomquist"",""V. L. Handa"",""E. C. Evers""}"
659896,Comparative effectiveness of instructional design features in simulation-based education: systematic review and meta-analysis.,eng,ENG,Med Teach,1466-187X,0.0,0.0,1/13/01,e867-98,"{""Benjamin Zendejas"",""Stanley J Hamstra"",""Rose Hatala"",""David A Cook"",""Amy T Wang"",""Jason H Szostek"",""Patricia J Erwin"",""Ryan Brydges""}"
84944,Bpdy mass index and outcome of ASC-H-interpreted cervical smears in postmenopausal women.,eng,eng,Acta Cytol.,,0.0,0.0,1/12/01,259-65,"{""Jae Jun Lee"",""Sang Yong Song"",""Soomin Ahn"",""Young Lyun Oh"",""Ji-Youn Sung"",""Chang Ohk Sung"",""Yoo-Young Lee""}"
326944," qobilisation with movement and exercise, corticosteroid injection, or wait and see for tennis elbow",eng,Atherosclerosis. Supplements,PloS one,1567-5688,0.0,0.0,1/3/12,29-32,{NULL}
922795,[Toxicology and clinical significance of base-catalized degradation of sevoflurane to Compound A].,ger,Schlafst_rungen bei kritisch kranken patienten,,17-Mar,0.0,0.0,1/14/01,S10-3,"{""R M Jones"",""P Conzen""}"
768486," qobilisation with movement and exercise, corticosteroid injection, or wait and see for tennis elbow",eng,BMJ Open,,2044-6055,0.0,0.0,1/14/01,e005601,{NULL}
428363,Case report. Cutaneous cryptococcosis in a patient with systemic erythematous lupus.,eng,Mycoses,Mvcoses,0933-7407,0.0,0.0,1/1/11,419-21,"{""L Ramos"",""S Mathur_n"",""A Mateo"",""C L_pez"",""C G_mez""}"
519287,A method for determining skeletal lengths from DXA images.,eng,BMC Musculoskelet Disord,BMC musculoskeletal disorders,1471-2474,0.0,0.0,1/14/01,113,"{""Glen M Blake"",""Tim D Spector"",""Ignac Fogelman"",""Usha Chinappen-Horsley""}"
638918," qobilisation with movement and exercise, corticosteroid injection, or wait and see for tennis elbow",eng,eng,,1433-2981,0.0,0.0,1/12/02,,"{""R Webster"",""E Spezi"",""S Mukherjee"",""R Adams"",""S Gwynne"",""J Staffurth"",""B Coles""}"
111336,The influence of smoking and impaired glucose homoeostasis on the outcome in patients presenting with an acute coronary syndrome: a cross-sectional study.,eng,,,2044-6055,0.0,0.0,1/14/01,e005077,"{""Anders Halling"",""Hkan Odeberg"",""Henrik Forssell"",""Jacob Odeberg"",""Marie-Louise Persson"",""Lennart Rstam"",""Ivar Vaara"",""Ulf Lindblad"",""Michael Freitag""}"
747279,Systematic review exploring the effect of exercise in pulmonary rehabilitation on depression levels in patients with chronic obstructive pulmonary disease,,eng,Physiotherapy,1469-493X,0.0,0.0,1/14/01,eS502-eS503,"{""Patil S."",""Horobin H.""}"
674696,Environmental and genomic factors as well as interventions influencing smoking cessation: a systematic review of reviews and a proposed working model.,eng,Public health genomics,Public Health Genomics,1662-8063,0.0,0.0,1/13/01,159-73,{NULL}
258108," qobilisation with movement and exercise, corticosteroid injection, or wait and see for tennis elbow",,eng,,1469-493X,0.0,0.0,1/13/01,e249-,"{""Mushro A"",""Niaura R S"",""Graham A L"",""Cobb N K"",""Fang Y"",""Cha S""}"
59308," qobilisation with movement and exercise, corticosteroid injection, or wait and see for tennis elbow",eng,Journal of the International Neuropsychological Society : JINS,J Int Neuropsychol Soc,1469-7661,0.0,0.0,1/10/01,,"{""Ramune Grambaite"",""Anders M Fjell"",""Tormod Fladby"",""Kristine B Walhovd"",""Vidar Stenset"",""Ivar Reinvang""}"
610641,Comparison between open and closed suction systems: a systematic review.,,eng,,1982-4335,0.0,0.0,1/8/12,,"{""Luiz Rogrio de Carvalho Oliveira"",""Nilza Aparecida Almeida de Carvalho"",""Flvio C L Cavalcanti Ara_jo"",""Izabela Menezes Pagotto"",""Paulo Chiavone""}"
631704,Association between interleukin-10 promoter polymorphisms and endometriosis: a meta-analysis.,eng,Gene,Gene,1879-0038,0.0,0.0,1/14/01,49-55,{NULL}
846537,Ozeractive bladder: Optimizing quality of care,,Am. J. Managed Care,,1088-0224,0.0,0.0,,S46-S61,{NULL}
973076,Thyroid-related autoantibodies and celiac disease: a role for a gluten-free diet?,,Journal of Clinical Gastroenterology,,1469-493X,0.0,0.0,1/2/09,245-8,"{""E. Mainardi"",""G. Moscato"",""A. Montanelli"",""M. Dotti"",""R. Nano""}"
931402,Providing access to specialty care for severely disabled institutional residents: an academic health center telemedicine model,,Journal of Health Care for the Poor & Underserved,,1049-2089,0.0,0.0,1/9/01,415-422 8p,{NULL}
908690,A robust method for diagnosis of morphological arrhythmias based on Hermitian model of higher-order statistics,,eng,Biomed Eng Online,1475-925X,0.0,0.0,1/11/01,22,{NULL}
417373,Shared decision making and the future of managed care,,eng,,1088-3371,0.0,0.0,,15-16,"{""J. E. Wennberg""}"
759329,Specific plasma factors blocking human maternal cell-mediated immune reaction to placental antigens.,eng,Nature: New biology,Nature New Biol.,0090-0028,0.0,0.0,3/28/73,110-1,"{""V Youtananukorn"",""P Mantangkasombut""}"
386327,MicroRNAs: a new piece in the paediatric cardiovascular disease puzzle.,eng,eng,Cardiol Young,,0.0,0.0,1/14/01,642-55,"{""Dalia Elimam"",""Keith A Webster"",""Ahmed Omran"",""Fei Yin"",""Lina A Shehadeh""}"
695010,Association of Ureaplasma urealyticum colonization with development of bronchopulmonary dysplasia: a systemic review and meta-analysis.,eng,Journal of Huazhong University of Science and Technology. Medical Sciences,J Huazhong Univ Sci Technolog Med Sci,1672-0733,0.0,0.0,1/14/04,265-9,"{""Jia-rui Pu"",""Dan Li"",""De-hua Yang"",""Li-duan Zheng"",""Xiao-dan Zheng"",""Hong Mei"",""Xuan Xiang"",""Qiang-song Tong""}"
191908,Mortality at older ages and moves in residential and sheltered housing: evidence from the UK,,Journal of Epidemiology and Community Health,,J. Am. Vet. Med. Assoc.,0.0,0.0,1/14/01,524-529,"{""J. Falkingham"",""M. Evandrou"",""A. Vlachantoni"",""J. Robards""}"
384767,A multinational study of thromboprophylaxis practice in critically ill children.,eng,eng,Crit. Care Med.,1530-0293,0.0,0.0,1/14/01,1232-40,{NULL}
855912,Asymmetric inheritance of mitochondrial content in aging budding yeast cells,eng,"Molecular Biology of the Cell. Conference: Annual Meeting of the American Society for Cell Biology, ASCB",,,0.0,0.0,1/12/01,,"{""E. A. Martin"",""L. F. Costa"",""H. Li"",""Y. Zhang"",""M. P. Viana"",""S. M. Rafelski"",""W. F. Marshall""}"
710727,Poysical activity moderates time-of-day differences in older adults' working memory performance.,,Ehperimental Aging Research,,1469-493X,0.0,0.0,1/6/10,431-446 16p,"{mDeLosh EL"",""Bugg JM"",""Clegg BA""}"
816996,Uses of the electrical skin resistance method in the study of patients with neck and upper extremity pain,eng,Jchns Hopkins Medical Journal,JOHNS HOPKINS MED. J.,,0.0,0.0,1/1/75,69-74,"{hC.P. Richter"",""L.H. Riley Jr.""}"
625016," qobilisation with movement and exercise, corticosteroid injection, or wait and see for tennis elbow",,Urologe A,,0340-2592,0.0,0.0,1/5/07,774-9,"{""P E Goretzki"",""B J Lammers"",""T Otto""}"
275675,An exploration of self-reported negative affect by adolescents as a reason for smoking: implications for tobacco prevention and intervention programs,eng,,Preventive medicine,0091-7435,0.0,0.0,1/5/01,589-96,{NULL}
967376,Doagnosis of peripheral lung cancer with three echoic features via endobronchial ultrasound,eng,Chest,,,0.0,0.0,1/7/01,922-9,"{""H. C. Chen"",""S. M. Lin"",""C. L. Chou"",""C. T. Yu"",""H. P. Kuo"",""C. H. Kuo""}"
640230,A meta-analysis of labor supply effects of interventions for major depressive disorder.,eng,Psychiatric Services.,PloS one,1075-2730,0.0,0.0,1/6/02,212-8,"{sJustin W Timbie"",""Marcela Horvitz-Lennon"",""Sharon-Lise T Normand"",""Richard G Frank""}"
625663,Combined pharmacotherapy and psychological treatment for depression: a systematic review.,eng,Archives of General Psychiatry,Arch.Gen.Psychiatry,0003-990X,0.0,0.0,1/14/01,714-9,"{""Paola Bollini"",""Giuseppe Tibaldi"",""Bruce Kupelnick"",""Carmine Munizza"",""Sandro Pampallona""}"
480649,Dyspareunia and sexual dysfunction following vaginal delivery in thai primiparous women with second degree perineal tear: A prospective cohort study,,Journal of Sexual Medicine,,1469-493X,0.0,0.0,1/15/01,58,{NULL}
782541," qobilisation with movement and exercise, corticosteroid injection, or wait and see for tennis elbow",eng,Interactive Cardiovascular & Thoracic Surgery,Interact Cardiovasc Thorac Surg,1569-9285,0.0,0.0,1/14/01,733,"{""D. G. Nezic""}"
692358,"The effect of a cervical lateral glide on the upper limb neurodynamic test: a blinded, placebo-controlled investigation",,"The Chartered Society of Physiotherapy Annual Congress and Exhibition: Defining Practice, Friday, October 17 to Sunday, October 19 2003, International Convention Centre, Birmingham.",Feb-62,1469-493X,0.0,0.0,1/3/01,,"{""A Green"",""J Lewis"",""C Worsfold"",""J Saranga""}"
836847,Thoracic Aortic Aneurysm: Reading the Enemy's Playbook,eng,Curr. Probl. Cardiol.,,-10475,0.0,0.0,,203-277,"{""Elefteriades J.A.""}"
867207,Early predicting of blood component quality by Statistical Process Control,,Vnx Sanguinis,,1469-493X,0.0,0.0,1/14/01,227,"{""H. Jungk"",""W. Madla"",""V. Schottstedt"",""T. Alt""}"
253149,Lifetime risk of suicide in affective disorders,,The British Journal of Psychiatry,,0007-1250 1472-1465,0.0,0.0,1/14/01,185-185,{NULL}
929971,A geographic analysis of chronically homeless adults before and after enrollment in a multi-site supported housing initiative: community characteristics and migration,,American Journal of Community Psychology,,0091-0562,0.0,0.0,1/14/01,341-51,"{""R. A. Rosenheck"",""J. Tsai"",""A. S. Mares""}"
470385," qobilisation with movement and exercise, corticosteroid injection, or wait and see for tennis elbow",,Ugtrasound Obstet. Gynecol.,,-8906,0.0,0.0,,314-320,"{""Lee W."",""Kirk J.S."",""Shaheen K.W."",""Romero R."",""Hodges A.N."",""Comstock C.H.""}"
731703," qobilisation with movement and exercise, corticosteroid injection, or wait and see for tennis elbow",,eng,,1469-493X,0.0,0.0,1/11/01,,{NULL}
113399,Use of Job Design to Reduce Mechanical Stress on the Back,eng,eng,,1469-493X,0.0,0.0,1/1/89,323-326,"{""D. W. Badger""}"
685178,Rehabilitation of swallowing by exercise in tube-fed patients with pharyngeal dysphagia secondary to abnormal UES opening.,eng,Annual Abstract Supplement,PloS one,1469-493X,0.0,0.0,1/2/05,1314-21,{NULL}
653325,A meta-analysis of two genome-wide association studies identifies 3 new loci for alcohol dependence.,eng,Journal of psychiatric research,J Psychiatr Res,1879-1379,0.0,0.0,1/11/11,1419-25,"{""Min Zeng"",""Yue Pan"",""Qunyuan Zhang"",""Ke-Sheng Wang"",""Nagesh Aragam"",""Xuefeng Liu""}"
893573,Crowdsourced Multimedia Enhanced Spatio-temporal Constraint Based on-Demand Social Network for Group Mobility,eng,eng,,1469-493X,0.0,0.0,1/15/01,761-762,"{""Ahmad Qamar"",""Muhammad Shahid"",""Md. Abdur Rahman"",""Ahmed Lbath"",""Akhlaq Ahmad"",""Faizan Ur Rehman"",""Abdullah Murad"",""Bilal Sadiq""}"
56272," qobilisation with movement and exercise, corticosteroid injection, or wait and see for tennis elbow",eng,Neurology,Neurology,1526-632X,0.0,0.0,8/20/13,736-44,{NULL}
737786,Cyanial reconstruction of major traumatic defects in children with osteoinductive and resorbable materials,,eng,,0901-5027,0.0,0.0,1/11/01,1024-1025,{NULL}
680306,Meta-analysis of the effects of sometribove zinc suspension on the production and health of lactating dairy cows.,eng,eng,PloS one,1943-569X,0.0,0.0,1/14/09,550-64,{NULL}
53877," qobilisation with movement and exercise, corticosteroid injection, or wait and see for tennis elbow",,eng,,1469-493X,0.0,0.0,1/14/01,37-41 DO  - 10.1080/10810730902805788,{NULL}
504928," qobilisation with movement and exercise, corticosteroid injection, or wait and see for tennis elbow",,eng,,1469-493X,0.0,0.0,1/7/01,,"{""Ilaria Casetta"",""Gerardo Iuliano"",""Graziella Filippini""}"
198650,Wound care,,,PloS one,,0.0,0.0,1/1/92,27-32 ST  - Wound care-,{NULL}
671386,Comparison between incidental malignant and benign breast lesions detected by computed tomography: a systematic review.,eng,Journal of medical imaging and radiation oncology,J Med Imaging Radiat Oncol,1754-9485,0.0,0.0,1/14/01,529-33,"{""Jasmin Abbas"",""Cholpan Jasaabuu"",""Andreas Gunter Bach"",""Alexey Surov"",""Dominik Schramm"",""Andreas Wienke""}"
981412,"Plant Kunitz proteinase inhibitor attenuates inflammation, oxidative stress and remodeling induced by elastase in mice",,eng,,1469-493X,0.0,0.0,1/14/01,,"{""N. M. Pinheiro"",""R. Almeida-Reis"",""L. Oliva"",""M. A. Martins"",""M. L. V. Oliva"",""O. A. Theodoro-Junior"",""E. A. Leick"",""I. F. L. C. Tibrio"",""C. M. Prado"",""R. F. Righetti"",""B. T. M. Oliveira""}"
785472,Streptococcus pneumoniae carriage in the Gaza strip,eng,PLoS One,PloS one,,0.0,0.0,1/12/01,e35061,"{""G. Rahav"",""G. Regev-Yochay"",""I. Abullaish"",""A. Elhamdany"",""R. Malley"",""M. Raz"",""A. Goral"",""Y. Roytman"",""B. Shainberg"",""M. Varon"",""A. Ziv""}"
734077,Direct healthcare costs and cost-effectiveness of acute coronary syndrome secondary prevention with ticagrelor compared to clopidogrel: Economic evaluation from the public payer's perspective in Poland based on the PLATO trial results,eng,eng,,0022-9032,0.0,0.0,1/14/01,,"{""M. Niewada"",""J. Paweska"",""A. Budaj"",""T. Macioch"",""P. Perkowski""}"
46028," qobilisation with movement and exercise, corticosteroid injection, or wait and see for tennis elbow",eng,European journal of applied physiology and occupational physiology,Eqr J Appl Physiol Occup Physiol,0301-5548,0.0,0.0,1/1/96,7-Jan,"{""S Ikawa"",""M Sudoh"",""M Suzuki"",""S Matsubara"",""M Shiota"",""K Kawakami""}"
743129,Hormonal and dietary characteristics in obese human subjects with and without food addiction.,eng,eng,Nutrients,2072-6643,0.0,0.0,1/14/01,223-38,"{""Pardis Pedram"",""Guang Sun""}"
392246," qobilisation with movement and exercise, corticosteroid injection, or wait and see for tennis elbow",eng,eng,,1473-0502,0.0,0.0,1/9/02,23-31,"{""Narumi Tomisawa"",""Akihiro C Yamashita""}"
904889,Myofascial trigger points: Spontaneous electrical activity and its consequences for pain induction and propagation,,eng,,1469-493X,0.0,0.0,,,{NULL}
360147,Treatment of large vessel vasculitis,,Current Immunology Reviews,,1469-493X,0.0,0.0,1/11/01,435-442,"{""M. A. Alba"",""S. Prieto-Gonzalez"",""A. Garcia-Martinez"",""M. C. Cid"",""M. Butjosa"",""G. Espigol-Frigole"",""J. Hernandez-Rodriguez""}"
670289,Quantitative assessment of the influence of common variations (rs8034191 and rs1051730) at 15q25 and lung cancer risk.,eng,eng,Tumour Biol.,1423-0380,0.0,0.0,1/14/03,2777-85,{NULL}
821702,Cognitive deficits and psychosis in Parkinson's disease: A review of pathophysiology and therapeutic options,eng,CNS Drugs,,,0.0,0.0,1/14/01,477-505,"{""T. Foltynie"",""R.A. Barker"",""S.J.G. Lewis"",""C.H. Williams-Gray""}"
188890," qobilisation with movement and exercise, corticosteroid injection, or wait and see for tennis elbow",eng,Scandinavian journal of infectious diseases. Supplementum,Scand J Infect Dis Suppl,0300-8878,0.0,0.0,1/1/91,22-34,"{""R Asanger"",""P M Shah"",""F M Kahan""}"
321660,Tuberculosis and high altitude. Worth a try in extensively drug-resistant tuberculosis?,eng,,,,0.0,0.0,1/14/01,390-3,"{""J. F. Murray""}"
427455," qobilisation with movement and exercise, corticosteroid injection, or wait and see for tennis elbow",eng,Applied nursing research : ANR,Appl Nurs Res,1532-8201,0.0,0.0,1/13/11,251-6,"{""Katherine A Yeager"",""Susan Bauer-Wu""}"
246204," qobilisation with movement and exercise, corticosteroid injection, or wait and see for tennis elbow",,Aktuelle Traumatologie,,1469-493X,0.0,0.0,1/4/01,64-70,"{""J. Oskam"",""J. H. Hegeman"",""J. Palen"",""H. J. Duis"",""P. A. M. Vierhout""}"
857402," qobilisation with movement and exercise, corticosteroid injection, or wait and see for tennis elbow",eng,JOURNAL OF CHEMICAL PHYSICS,,Diabetes Technol. Ther.,0.0,0.0,1/7/01,84301,"{""D. A. Tyurin"",""V. A. Belov"",""D. N. Laikov"",""A. V. Akimov"",""E. Y. Misochko""}"
704357,Clinical and radiological results of calcium phosphate cement-assisted balloon osteoplasty for Colles' fractures in osteoporotic senile female patients,eng,J Orthop Sci,Journal of orthopaedic science : official journal of the Japanese Orthopaedic Association,,0.0,0.0,1/10/01,204-9,"{""A. Sudo"",""S. Ishiguro"",""K. Iida""}"
716785,Explosive power and asymmetry in leg muscle function in frequent fallers and non-fallers aged over 65,,eng,,1469-493X,0.0,0.0,1/2/01,119-125 7p,{NULL}
746065,Anxiety and depression in patients with chronic obstructive pulmonary disease: an open agenda for research.,,Rev Med Chir Soc Med Nat Iasi,Revista medico-chirurgicala a Societatii de Medici si Naturalisti din Iasi,0048-7848 (Print) 0048-7848,0.0,0.0,1/14/01,,"{""Costin M."",""Dumbrav__ E.L."",""Postolache P."",""Cojocaru D.C.""}"
738322,Ceassification of autogenous skull grafts in cranial reconstruction,eng,J Okla State Med Assoc,The Journal of the Oklahoma State Medical Association,,0.0,0.0,1/1/93,327-32,{NULL}
934177,An Assessment of Voluntary Adolescent Mental Health Screening and Referral in a Children's Hospital Emergency Department,,eng,,1469-493X,0.0,0.0,,,{NULL}
351534," qobilisation with movement and exercise, corticosteroid injection, or wait and see for tennis elbow",eng,eng,,,0.0,0.0,1/3/01,1295-1305,"{""T Delormier"",""A C Macaulay"",""M Cargo"",""A M McComber"",""L Potvin""}"
872389,Brle acid metabolism by fresh human colonic contents: a comparison of caecal versus faecal samples.,eng,Gut,Gut,0017-5749,0.0,0.0,1/1/12,835-42,{NULL}
499983,Twe role of viral infection in pulmonary exacerbations of     bronchiectasis in adults: a prospective study,eng,eng,,,0.0,0.0,1/15/01,1635-1643,{NULL}
452432," qobilisation with movement and exercise, corticosteroid injection, or wait and see for tennis elbow",,,,,0.0,0.0,,,{NULL}
320139," qobilisation with movement and exercise, corticosteroid injection, or wait and see for tennis elbow",eng,,,,0.0,0.0,1/12/01,1331-4,"{""J. P. Cegielski"",""S. P. Althomsons""}"
735083," qobilisation with movement and exercise, corticosteroid injection, or wait and see for tennis elbow",,European journal of applied physiology,,1439-6327,0.0,0.0,8/15/10,,"{""Sebastien Racinais"",""Olivier Girard"",""Lars Nybo"",""Magni Mohr"",""Martin Thomassen""}"
978471," qobilisation with movement and exercise, corticosteroid injection, or wait and see for tennis elbow",eng,eng,,1469-493X,0.0,0.0,1/14/01,663-695,"{""Gary P. Wormser"",""Alvin E. Friedman-Kien"",""Miguel Sanchez""}"
152626,Recurrent distal 16q duplication and terminal 22q deletion: prenatal diagnosis and genetic counseling,eng,eng,,,0.0,0.0,1/10/01,544-7 ST  - Recurrent distal 16q duplication and terminal 22q deletion: prenatal diagnosis and genetic counseling-,{NULL}
90272," qobilisation with movement and exercise, corticosteroid injection, or wait and see for tennis elbow",,Radiology,Radiology,1527-1315,0.0,0.0,1/14/01,,"{""Qiao-Hong Hu"",""Zhi-Liang Huang"",""Xiao-Ming Fan"",""Shuang-Xi Chen"",""Xiang-Yang Song"",""Xiao-Ying Qiu""}"
776651,The endoplasmic reticulum-associated VP7 of rotavirus is targeted to axons and dendrites in polarized neurons,eng,Journal of Neurocytology,,,0.0,0.0,1/14/01,,"{""K. Kristensson"",""L. Svensson"",""H. B. Greenberg"",""K. Weclewicz""}"
931361,Telemedicine in the management of chronic pain: a cost analysis study,,eng,,1469-493X,0.0,0.0,1/9/01,590-6,{NULL}
623358,Moderation of cognition-intention and cognition-behaviour relations: a meta-analysis of properties of variables from the theory of planned behaviour.,eng,The British journal of social psychology / the British Psychological Society,PloS one,0144-6665,0.0,0.0,1/4/06,159-86,"{""Paschal Sheeran"",""Richard Cooke""}"
385940," qobilisation with movement and exercise, corticosteroid injection, or wait and see for tennis elbow",eng,Cardiology in the young,PloS one,1467-1107,0.0,0.0,1/14/06,520-3,"{""Jesper I Reimers"",""Sabrina G Ellese"",""Henrik  Andersen""}"
951168," qobilisation with movement and exercise, corticosteroid injection, or wait and see for tennis elbow",,eng,,420980,0.0,0.0,1/3/01,2049,{NULL}
515254,Radiographic detection of artificially created horizontal root fracture using different cone beam CT units with small fields of view.,eng,Dento maxillo facial radiology,Dentomaxillofac Radiol,0250-832X,0.0,0.0,1/13/01,20120261,{NULL}
674623,Pharmacological treatments for obsessive-compulsive disorder in children and adolescents: a qualitative review.,eng,Actas espaolas de psiquiatr_a,Actas Esp Psiquiatr,1578-2735,0.0,0.0,1/13/05,196-203,{NULL}
226419,Anterior approach unilateral right sacrospinous fixation for recurrent pelvic organ prolapse following multiple colorectal surgeries.,eng,eng,,1432-1262,0.0,0.0,7/15/01,,{NULL}
178078,A community-based trachoma survey: Prevalence and risk factors in the Tigray region of northern Ethiopia,,eng,,1469-493X,0.0,0.0,1/6/01,173-181,"{""J. De La Camera"",""M. M. Mesfin"",""A. M. Kedir"",""G. Amanual"",""T. Araya"",""I. G. Tareke""}"
453637,Corneal collagen cross-linking for nonectatic disorders: A systematic review.,eng,eng,,1469-493X,0.0,0.0,1/14/01,,{gULL}
57483,Multiple dural arteriovenous fistulas presenting as rapidly progressive dementia.,eng,eng,Neurologist,1074-7931,0.0,0.0,1/12/05,130-2,{NULL}
462849," qobilisation with movement and exercise, corticosteroid injection, or wait and see for tennis elbow",,,,,0.0,0.0,,,{NULL}
338547,New therapies in soft tissue sarcoma,eng,Expert opinion on emerging drugs,Expert Opin Emerg Drugs,1744-7623,0.0,0.0,1/10/01,237-48,"{""Bruno Vincenzi"",""Daniele Santini"",""Giuseppe Tonini"",""Anna Maria Frezza""}"
438808,Descemet's stripping endothelial keratoplasty: safety and outcomes: a report by the American Academy of Ophthalmology,,,,,0.0,0.0,,,{NULL}
352040," qobilisation with movement and exercise, corticosteroid injection, or wait and see for tennis elbow",,ger,,1533-7731,0.0,0.0,1/13/01,26-Jan,"{""Joel W. Grube"",""Juan A. Luna"",""David A. Gilder"",""Jennifer Roberts"",""Daniel Calac"",""Cindy L. Ehlers"",""Roland S. Moore""}"
